"","Cites","Authors","Title","Year","Source","Publisher","ArticleURL","CitesURL","GSRank","QueryDate","Type","DOI","ISSN","CitationURL","Volume","Issue","StartPage","EndPage","ECC","CitesPerYear","CitesPerAuthor","AuthorCount","Age","Abstract","FullTextURL","RelatedURL"
"1",1667,"CJ Soto, OP John","The next Big Five Inventory (BFI-2): Developing and assessing a hierarchical model with 15 facets to enhance bandwidth, fidelity, and predictive power.",2017,"Journal of personality and social psychology","psycnet.apa.org","https://psycnet.apa.org/journals/psp/113/1/117/","https://scholar.google.com/scholar?cites=1930066906524475489&as_sdt=2005&sciodt=0,5&hl=en",1,2023-08-22 15:47:17,NA,NA,NA,NA,NA,NA,NA,NA,1667,277.83,834,2,6,"Abstract [Correction Notice: An Erratum for this article was reported in Vol 113 (1) of Journal of Personality and Social Psychology (see record 2017-26058-001). In the article, all …","https://escholarship.org/content/qt16x6n05t/qt16x6n05t.pdf","https://scholar.google.com/scholar?q=related:YeAgJKD5yBoJ:scholar.google.com/&scioq=source:%22journal+of+personality+and+social+psychology%22&hl=en&as_sdt=0,5&as_ylo=2017&as_yhi=2017"
"2",1617,"M Credé, MC Tynan, PD Harms","Much ado about grit: A meta-analytic synthesis of the grit literature.",2017,"Journal of Personality and social …","psycnet.apa.org","https://psycnet.apa.org/journals/psp/113/3/492/","https://scholar.google.com/scholar?cites=7854456031676606478&as_sdt=2005&sciodt=0,5&hl=en",2,2023-08-22 15:47:17,NA,NA,NA,NA,NA,NA,NA,NA,1617,269.5,539,3,6,"Grit has been presented as a higher order personality trait that is highly predictive of both success and performance and distinct from other traits such as conscientiousness. This …","https://www.academia.edu/download/45783523/Much_Ado_about_Grit_A_Meta-Analytic_Synt.pdf","https://scholar.google.com/scholar?q=related:DigCaCWiAG0J:scholar.google.com/&scioq=source:%22journal+of+personality+and+social+psychology%22&hl=en&as_sdt=0,5&as_ylo=2017&as_yhi=2017"
"3",375,"LX Zou, S Cheryan","Two axes of subordination: A new model of racial position.",2017,"Journal of personality and social psychology","psycnet.apa.org","https://psycnet.apa.org/record/2017-08699-001","https://scholar.google.com/scholar?cites=17590212801014791239&as_sdt=2005&sciodt=0,5&hl=en",3,2023-08-22 15:47:17,NA,NA,NA,NA,NA,NA,NA,NA,375,62.5,188,2,6,"Theories of race relations have been shaped by the concept of a racial hierarchy along which Whites are the most advantaged and African Americans the most disadvantaged …","https://psycnet.apa.org/manuscript/2017-08699-001.pdf","https://scholar.google.com/scholar?q=related:R_wDeFj9HPQJ:scholar.google.com/&scioq=source:%22journal+of+personality+and+social+psychology%22&hl=en&as_sdt=0,5&as_ylo=2017&as_yhi=2017"
"4",363,"JP Wilson, K Hugenberg, NO Rule","Racial bias in judgments of physical size and formidability: From size to threat.",2017,"Journal of personality and …","psycnet.apa.org","https://psycnet.apa.org/record/2017-11085-001","https://scholar.google.com/scholar?cites=11783107123550586782&as_sdt=2005&sciodt=0,5&hl=en",4,2023-08-22 15:47:17,NA,NA,NA,NA,NA,NA,NA,NA,363,60.5,121,3,6,"Black men tend to be stereotyped as threatening and, as a result, may be disproportionately targeted by police even when unarmed. Here, we found evidence that biased perceptions of …","https://psycnet.apa.org/manuscript/2017-11085-001.pdf","https://scholar.google.com/scholar?q=related:noeb0X8BhqMJ:scholar.google.com/&scioq=source:%22journal+of+personality+and+social+psychology%22&hl=en&as_sdt=0,5&as_ylo=2017&as_yhi=2017"
"5",354,"AM Gordon, JE Stellar, CL Anderson…","The dark side of the sublime: Distinguishing a threat-based variant of awe.",2017,"… personality and social …","psycnet.apa.org","https://psycnet.apa.org/record/2016-59114-001","https://scholar.google.com/scholar?cites=209887511805701900&as_sdt=2005&sciodt=0,5&hl=en",5,2023-08-22 15:47:17,NA,NA,NA,NA,NA,NA,NA,NA,354,59,89,4,6,"Theoretical conceptualizations of awe suggest this emotion can be more positive or negative depending on specific appraisal processes. However, the emergent scientific study of awe …","https://sites.lsa.umich.edu/whirl/wp-content/uploads/sites/792/2020/08/2017-The-dark-side-of-the-sublime.pdf","https://scholar.google.com/scholar?q=related:DC_4d5Sr6QIJ:scholar.google.com/&scioq=source:%22journal+of+personality+and+social+psychology%22&hl=en&as_sdt=0,5&as_ylo=2017&as_yhi=2017"
"6",308,"Y Bai, LA Maruskin, S Chen, AM Gordon…","Awe, the diminished self, and collective engagement: Universals and cultural variations in the small self.",2017,"… personality and social …","psycnet.apa.org","https://psycnet.apa.org/journals/psp/113/2/185/","https://scholar.google.com/scholar?cites=11598503909146966041&as_sdt=2005&sciodt=0,5&hl=en",6,2023-08-22 15:47:17,NA,NA,NA,NA,NA,NA,NA,NA,308,51.33,62,5,6,"Awe has been theorized as a collective emotion, one that enables individuals to integrate into social collectives. In keeping with this theorizing, we propose that awe diminishes the …","https://www.academia.edu/download/78318568/Bai_et_al._2017_JPSP.pdf","https://scholar.google.com/scholar?q=related:GTivltop9qAJ:scholar.google.com/&scioq=source:%22journal+of+personality+and+social+psychology%22&hl=en&as_sdt=0,5&as_ylo=2017&as_yhi=2017"
"7",299,"R Mõttus, C Kandler, W Bleidorn…","Personality traits below facets: The consensual validity, longitudinal stability, heritability, and utility of personality nuances.",2017,"Journal of Personality …","psycnet.apa.org","https://psycnet.apa.org/record/2016-21274-001","https://scholar.google.com/scholar?cites=10662798457842789937&as_sdt=2005&sciodt=0,5&hl=en",7,2023-08-22 15:47:17,NA,NA,NA,NA,NA,NA,NA,NA,299,49.83,75,4,6,"It has been argued that facets do not represent the bottom of the personality hierarchy—even more specific personality characteristics, nuances, could be useful for describing and …","https://www.zora.uzh.ch/id/eprint/206362/1/219856808.pdf","https://scholar.google.com/scholar?q=related:MW5NF7Te-ZMJ:scholar.google.com/&scioq=source:%22journal+of+personality+and+social+psychology%22&hl=en&as_sdt=0,5&as_ylo=2017&as_yhi=2017"
"8",290,"DN Jones, DL Paulhus","Duplicity among the dark triad: Three faces of deceit.",2017,"… of Personality and Social Psychology","psycnet.apa.org","https://psycnet.apa.org/journals/psp/113/2/329/","https://scholar.google.com/scholar?cites=5186505495363929255&as_sdt=2005&sciodt=0,5&hl=en",8,2023-08-22 15:47:17,NA,NA,NA,NA,NA,NA,NA,NA,290,48.33,145,2,6,"Although all 3 of the Dark Triad members are predisposed to engage in exploitative interpersonal behavior, their motivations and tactics vary. Here we explore their distinctive …","https://www.researchgate.net/profile/Delroy-Paulhus/publication/314202102_Duplicity_Among_the_Dark_Triad_Three_Faces_of_Deceit/links/5901c96e0f7e9bcf654890c7/Duplicity-Among-the-Dark-Triad-Three-Faces-of-Deceit","https://scholar.google.com/scholar?q=related:p0THzEQr-kcJ:scholar.google.com/&scioq=source:%22journal+of+personality+and+social+psychology%22&hl=en&as_sdt=0,5&as_ylo=2017&as_yhi=2017"
"9",219,"J Borghuis, JJA Denissen, D Oberski…","Big Five personality stability, change, and codevelopment across adolescence and early adulthood.",2017,"… personality and social …","psycnet.apa.org","https://psycnet.apa.org/record/2017-09436-001","https://scholar.google.com/scholar?cites=14843372584527434930&as_sdt=2005&sciodt=0,5&hl=en",9,2023-08-22 15:47:17,NA,NA,NA,NA,NA,NA,NA,NA,219,36.5,55,4,6,"Using data from 2 large and overlapping cohorts of Dutch adolescents, containing up to 7 waves of longitudinal data each (N= 2,230), the present study examined Big Five personality …","https://dspace.library.uu.nl/bitstream/handle/1874/358188/Big.pdf?sequence=1","https://scholar.google.com/scholar?q=related:spSH2bhA_s0J:scholar.google.com/&scioq=source:%22journal+of+personality+and+social+psychology%22&hl=en&as_sdt=0,5&as_ylo=2017&as_yhi=2017"
"10",220,"LJ Kray, L Howland, AG Russell…","The effects of implicit gender role theories on gender system justification: Fixed beliefs strengthen masculinity to preserve the status quo.",2017,"… of personality and social …","psycnet.apa.org","https://psycnet.apa.org/journals/psp/112/1/98/","https://scholar.google.com/scholar?cites=12180711850398191767&as_sdt=2005&sciodt=0,5&hl=en",10,2023-08-22 15:47:17,NA,NA,NA,NA,NA,NA,NA,NA,220,36.67,55,4,6,"Abstract Four studies (n= 1199) tested support for the idea that implicit theories about the fixedness versus malleability of gender roles (entity vs. incremental theories) predict …","https://www.academia.edu/download/80849250/Kray_2017.pdf","https://scholar.google.com/scholar?q=related:lxBgSuSUCqkJ:scholar.google.com/&scioq=source:%22journal+of+personality+and+social+psychology%22&hl=en&as_sdt=0,5&as_ylo=2017&as_yhi=2017"
"11",216,"SN Wurst, TM Gerlach, M Dufner…","Narcissism and romantic relationships: The differential impact of narcissistic admiration and rivalry.",2017,"Journal of Personality …","psycnet.apa.org","https://psycnet.apa.org/record/2016-41149-001","https://scholar.google.com/scholar?cites=14940052618126021402&as_sdt=2005&sciodt=0,5&hl=en",11,2023-08-22 15:47:17,NA,NA,NA,NA,NA,NA,NA,NA,216,36,54,4,6,"Narcissism is known to be related to romantic success in short-term contexts (dating, early stage relationships) but also to problems in long-term committed relationships. We propose …","https://www.researchgate.net/profile/Stefanie-Wurst/publication/305281174_Narcissism_and_Romantic_Relationships_The_Differential_Impact_of_Narcissistic_Admiration_and_Rivalry/links/59550341a6fdcc16978cbc3d/Narcissism-and-Romantic-Relationships-The-Differential-Impact-of-Narcissistic-Admiration-and-Rivalry.pdf","https://scholar.google.com/scholar?q=related:GtMLTbO6Vc8J:scholar.google.com/&scioq=source:%22journal+of+personality+and+social+psychology%22&hl=en&as_sdt=0,5&as_ylo=2017&as_yhi=2017"
"12",217,"S Parrigon, SE Woo, L Tay, T Wang","CAPTION-ing the situation: A lexically-derived taxonomy of psychological situation characteristics.",2017,"Journal of personality and …","psycnet.apa.org","https://psycnet.apa.org/record/2016-40096-001","https://scholar.google.com/scholar?cites=8718287897212571247&as_sdt=2005&sciodt=0,5&hl=en",12,2023-08-22 15:47:17,NA,NA,NA,NA,NA,NA,NA,NA,217,36.17,54,4,6,"In comparison with personality taxonomic research, there has been much less advancement toward establishing an integrative taxonomy of psychological situation characteristics …",NA,"https://scholar.google.com/scholar?q=related:b07xqqaU_XgJ:scholar.google.com/&scioq=source:%22journal+of+personality+and+social+psychology%22&hl=en&as_sdt=0,5&as_ylo=2017&as_yhi=2017"
"13",212,"K Geukes, S Nestler, R Hutteman…","Puffed-up but shaky selves: State self-esteem level and variability in narcissists.",2017,"… personality and social …","psycnet.apa.org","https://psycnet.apa.org/record/2016-55335-001","https://scholar.google.com/scholar?cites=4371471215443797604&as_sdt=2005&sciodt=0,5&hl=en",13,2023-08-22 15:47:17,NA,NA,NA,NA,NA,NA,NA,NA,212,35.33,53,4,6,"Different theoretical conceptualizations characterize grandiose narcissists by high, yet fragile self-esteem. Empirical evidence, however, has been inconsistent, particularly …","https://www.researchgate.net/profile/Mitja-Back/publication/304135726_Puffed-Up_But_Shaky_Selves_State_Self-Esteem_Level_and_Variability_in_Narcissists/links/5767a1cb08aeb4b998098f12/Puffed-Up-But-Shaky-Selves-State-Self-Esteem-Level-and-Variability-in-Narcissists.pdf","https://scholar.google.com/scholar?q=related:ZGZfzuiVqjwJ:scholar.google.com/&scioq=source:%22journal+of+personality+and+social+psychology%22&hl=en&as_sdt=0,5&as_ylo=2017&as_yhi=2017"
"14",212,"K Huang, M Yeomans, AW Brooks…","It doesn't hurt to ask: Question-asking increases liking.",2017,"… and social psychology","psycnet.apa.org","https://psycnet.apa.org/record/2017-18566-001","https://scholar.google.com/scholar?cites=2861190612497987367&as_sdt=2005&sciodt=0,5&hl=en",14,2023-08-22 15:47:17,NA,NA,NA,NA,NA,NA,NA,NA,212,35.33,53,4,6,"Conversation is a fundamental human experience that is necessary to pursue intrapersonal and interpersonal goals across myriad contexts, relationships, and modes of …","https://dash.harvard.edu/bitstream/handle/1/35647952/huangyeomansbrooksminsongino_QuestionAsking_Manuscript.pdf?sequence=1","https://scholar.google.com/scholar?q=related:J_ef7LP9tCcJ:scholar.google.com/&scioq=source:%22journal+of+personality+and+social+psychology%22&hl=en&as_sdt=0,5&as_ylo=2017&as_yhi=2017"
"15",215,"B Gawronski, J Armstrong, P Conway…","Consequences, norms, and generalized inaction in moral dilemmas: The CNI model of moral decision-making.",2017,"Journal of Personality …","psycnet.apa.org","https://psycnet.apa.org/record/2017-34831-001","https://scholar.google.com/scholar?cites=13490096407604884132&as_sdt=2005&sciodt=0,5&hl=en",15,2023-08-22 15:47:17,NA,NA,NA,NA,NA,NA,NA,NA,215,35.83,54,4,6,"Research on moral dilemma judgments has been fundamentally shaped by the distinction between utilitarianism and deontology. According to the principle of utilitarianism, the moral …","http://bertramgawronski.com/documents/GACFH2017JPSP.pdf","https://scholar.google.com/scholar?q=related:pPIPiTVzNrsJ:scholar.google.com/&scioq=source:%22journal+of+personality+and+social+psychology%22&hl=en&as_sdt=0,5&as_ylo=2017&as_yhi=2017"
"16",202,"E Hehman, CAM Sutherland, JK Flake…","The unique contributions of perceiver and target characteristics in person perception.",2017,"… and social psychology","psycnet.apa.org","https://psycnet.apa.org/record/2017-20210-001","https://scholar.google.com/scholar?cites=10417714227458888466&as_sdt=2005&sciodt=0,5&hl=en",16,2023-08-22 15:47:17,NA,NA,NA,NA,NA,NA,NA,NA,202,33.67,51,4,6,"Abstract Models of person perception have long asserted that our impressions of others are guided by characteristics of both the target and perceiver. However, research has not yet …","http://aura.abdn.ac.uk/bitstream/handle/2164/12695/Hehman_et_al_2017_The_unique_contributions.pdf?sequence=1","https://scholar.google.com/scholar?q=related:ElM4--Qnk5AJ:scholar.google.com/&scioq=source:%22journal+of+personality+and+social+psychology%22&hl=en&as_sdt=0,5&as_ylo=2017&as_yhi=2017"
"17",184,"CI Cortland, MA Craig, JR Shapiro…","Solidarity through shared disadvantage: Highlighting shared experiences of discrimination improves relations between stigmatized groups.",2017,"… personality and social …","psycnet.apa.org","https://psycnet.apa.org/journals/psp/113/4/547/","https://scholar.google.com/scholar?cites=12165243115329869388&as_sdt=2005&sciodt=0,5&hl=en",17,2023-08-22 15:47:17,NA,NA,NA,NA,NA,NA,NA,NA,184,30.67,46,4,6,"Intergroup relations research has largely focused on relations between members of dominant groups and members of disadvantaged groups. The small body of work examining …","https://escholarship.org/content/qt94f8b6db/qt94f8b6db.pdf","https://scholar.google.com/scholar?q=related:TNaAvyig06gJ:scholar.google.com/&scioq=source:%22journal+of+personality+and+social+psychology%22&hl=en&as_sdt=0,5&as_ylo=2017&as_yhi=2017"
"18",168,"TB Bitterly, AW Brooks…","Risky business: When humor increases and decreases status.",2017,"Journal of personality and …","psycnet.apa.org","https://psycnet.apa.org/record/2016-54537-001","https://scholar.google.com/scholar?cites=15586482933743527512&as_sdt=2005&sciodt=0,5&hl=en",18,2023-08-22 15:47:17,NA,NA,NA,NA,NA,NA,NA,NA,168,28,56,3,6,"Across 8 experiments, we demonstrate that humor can influence status, but attempting to use humor is risky. The successful use of humor can increase status in both new and …","https://www.hbs.edu/ris/Publication%20Files/Bitterly%20Brooks%20Schweitzer%20JPSP%202016_54efbab5-2561-4408-b008-38d958e0ad50.pdf","https://scholar.google.com/scholar?q=related:WKZ4w6VPTtgJ:scholar.google.com/&scioq=source:%22journal+of+personality+and+social+psychology%22&hl=en&as_sdt=0,5&as_ylo=2017&as_yhi=2017"
"19",163,"A Bhattacharjee, J Dana, J Baron","Anti-profit beliefs: How people neglect the societal benefits of profit.",2017,"Journal of personality and …","psycnet.apa.org","https://psycnet.apa.org/journals/psp/113/5/671/","https://scholar.google.com/scholar?cites=15144697626764609103&as_sdt=2005&sciodt=0,5&hl=en",19,2023-08-22 15:47:17,NA,NA,NA,NA,NA,NA,NA,NA,163,27.17,54,3,6,"Profit-seeking firms are stereotypically depicted as immoral and harmful to society. At the same time, profit-driven enterprise has contributed immensely to human prosperity. Though …","https://www.researchgate.net/profile/Jason-Dana-2/publication/318596903_Anti-Profit_Beliefs_How_People_Neglect_the_Societal_Benefits_of_Profit/links/5979111baca27203ecc6335e/Anti-Profit-Beliefs-How-People-Neglect-the-Societal-Benefits-of-Profit.pdf","https://scholar.google.com/scholar?q=related:T4YBYkDGLNIJ:scholar.google.com/&scioq=source:%22journal+of+personality+and+social+psychology%22&hl=en&as_sdt=0,5&as_ylo=2017&as_yhi=2017"
"20",163,"MJ Brandt, DR Van Tongeren","People both high and low on religious fundamentalism are prejudiced toward dissimilar groups.",2017,"… Personality and Social Psychology","psycnet.apa.org","https://psycnet.apa.org/record/2015-49839-001","https://scholar.google.com/scholar?cites=10650086560901392192&as_sdt=2005&sciodt=0,5&hl=en",20,2023-08-22 15:47:17,NA,NA,NA,NA,NA,NA,NA,NA,163,27.17,82,2,6,"Abstract [Correction Notice: An Erratum for this article was reported in Vol 112 (1) of Journal of Personality and Social Psychology (see record 2016-61714-004). In the article, the …","https://osf.io/fn3j7/download","https://scholar.google.com/scholar?q=related:QGew8Uy1zJMJ:scholar.google.com/&scioq=source:%22journal+of+personality+and+social+psychology%22&hl=en&as_sdt=0,5&as_ylo=2017&as_yhi=2017"
"21",162,"EC Luciano, U Orth","Transitions in romantic relationships and development of self-esteem.",2017,"Journal of personality and Social Psychology","psycnet.apa.org","https://psycnet.apa.org/record/2016-32761-001","https://scholar.google.com/scholar?cites=10117514482565799984&as_sdt=2005&sciodt=0,5&hl=en",21,2023-08-22 15:47:17,NA,NA,NA,NA,NA,NA,NA,NA,162,27,81,2,6,"Research suggests that self-esteem increases during late adolescence and young adulthood, but that there is large interindividual variability in this development. However …","https://boris.unibe.ch/95490/7/Luciano%20and%20Orth%202017%20JPSP.pdf","https://scholar.google.com/scholar?q=related:MGA0J9GhaIwJ:scholar.google.com/&scioq=source:%22journal+of+personality+and+social+psychology%22&hl=en&as_sdt=0,5&as_ylo=2017&as_yhi=2017"
"22",153,"JT Crawford, MJ Brandt, Y Inbar…","Social and economic ideologies differentially predict prejudice across the political spectrum, but social issues are most divisive.",2017,"… personality and social …","psycnet.apa.org","https://psycnet.apa.org/record/2017-07143-004","https://scholar.google.com/scholar?cites=7210204238694560376&as_sdt=2005&sciodt=0,5&hl=en",22,2023-08-22 15:47:17,NA,NA,NA,NA,NA,NA,NA,NA,153,25.5,38,4,6,"Liberals and conservatives both express prejudice toward ideologically dissimilar others (Brandt et al., 2014). Previous work on ideological prejudice did not take advantage of …","https://psyarxiv.com/3g5pz/download?format=pdf","https://scholar.google.com/scholar?q=related:eLJnxY3KD2QJ:scholar.google.com/&scioq=source:%22journal+of+personality+and+social+psychology%22&hl=en&as_sdt=0,5&as_ylo=2017&as_yhi=2017"
"23",156,"RT Bjornsdottir, NO Rule","The visibility of social class from facial cues.",2017,"… of personality and social psychology","psycnet.apa.org","https://psycnet.apa.org/journals/psp/113/4/530/","https://scholar.google.com/scholar?cites=7191975452213085125&as_sdt=2005&sciodt=0,5&hl=en",23,2023-08-22 15:47:17,NA,NA,NA,NA,NA,NA,NA,NA,156,26,78,2,6,"Social class meaningfully impacts individuals' life outcomes and daily interactions, and the mere perception of one's socioeconomic standing can have significant ramifications. To …","https://www.researchgate.net/profile/R-Thora-Bjornsdottir/publication/317252320_The_Visibility_of_Social_Class_From_Facial_Cues/links/592eddc0a6fdcc89e76bbc04/The-Visibility-of-Social-Class-From-Facial-Cues.pdf","https://scholar.google.com/scholar?q=related:xYN9rpEHz2MJ:scholar.google.com/&scioq=source:%22journal+of+personality+and+social+psychology%22&hl=en&as_sdt=0,5&as_ylo=2017&as_yhi=2017"
"24",153,"DS Chester, CN DeWall","Combating the sting of rejection with the pleasure of revenge: A new look at how emotion shapes aggression.",2017,"… of personality and social psychology","psycnet.apa.org","https://psycnet.apa.org/record/2016-52939-001","https://scholar.google.com/scholar?cites=17355774717211443941&as_sdt=2005&sciodt=0,5&hl=en",24,2023-08-22 15:47:17,NA,NA,NA,NA,NA,NA,NA,NA,153,25.5,77,2,6,"How does emotion explain the relationship between social rejection and aggression? Rejection reliably damages mood, leaving individuals motivated to repair their negatively …","https://psycnet.apa.org/manuscript/2016-52939-001.pdf","https://scholar.google.com/scholar?q=related:5QIYhSYZ3PAJ:scholar.google.com/&scioq=source:%22journal+of+personality+and+social+psychology%22&hl=en&as_sdt=0,5&as_ylo=2017&as_yhi=2017"
"25",138,"G Stoll, S Rieger, O Lüdtke, B Nagengast…","Vocational interests assessed at the end of high school predict life outcomes assessed 10 years later over and above IQ and Big Five personality traits.",2017,"… personality and social …","psycnet.apa.org","https://psycnet.apa.org/record/2016-41148-001","https://scholar.google.com/scholar?cites=10564549322106880474&as_sdt=2005&sciodt=0,5&hl=en",25,2023-08-22 15:47:17,NA,NA,NA,NA,NA,NA,NA,NA,138,23,28,5,6,"Vocational interests are important aspects of personality that reflect individual differences in motives, goals, and personal strivings. It is therefore plausible that these characteristics have …","https://www.researchgate.net/profile/Gundula-Stoll/publication/306918284_Vocational_Interests_Assessed_at_the_End_of_High_School_Predict_Life_Outcomes_Assessed_10_Years_Later_Over_and_Above_IQ_and_Big_Five_Personality_Traits/links/5bb318bb45851574f7f44bf8/Vocational-Interests-Assessed-at-the-End-of-High-School-Predict-Life-Outcomes-Assessed-10-Years-Later-Over-and-Above-IQ-and-Big-Five-Personality-Traits.pdf","https://scholar.google.com/scholar?q=related:2kFGlKLRnJIJ:scholar.google.com/&scioq=source:%22journal+of+personality+and+social+psychology%22&hl=en&as_sdt=0,5&as_ylo=2017&as_yhi=2017"
"26",137,"ML Slepian, JS Chun, MF Mason","The experience of secrecy.",2017,"Journal of Personality and …","psycnet.apa.org","https://psycnet.apa.org/journals/psp/113/1/1/","https://scholar.google.com/scholar?cites=11507556964733006905&as_sdt=2005&sciodt=0,5&hl=en",26,2023-08-22 15:47:17,NA,NA,NA,NA,NA,NA,NA,NA,137,22.83,46,3,6,"The concept of secrecy calls to mind a dyadic interaction: one person hiding a secret from another during a conversation or social interaction. The current work, however …","https://www.academia.edu/download/53672097/Slepian__Chun___Mason_2017_JPSP.pdf","https://scholar.google.com/scholar?q=related:ObR7-xYOs58J:scholar.google.com/&scioq=source:%22journal+of+personality+and+social+psychology%22&hl=en&as_sdt=0,5&as_ylo=2017&as_yhi=2017"
"27",139,"NS Kteily, J Sheehy-Skeffington…","Hierarchy in the eye of the beholder:(Anti-) egalitarianism shapes perceived levels of social inequality.",2017,"Journal of Personality and …","psycnet.apa.org","https://psycnet.apa.org/record/2016-21275-001","https://scholar.google.com/scholar?cites=8948041899869024341&as_sdt=2005&sciodt=0,5&hl=en",27,2023-08-22 15:47:17,NA,NA,NA,NA,NA,NA,NA,NA,139,23.17,46,3,6,"Debate surrounding the issue of inequality and hierarchy between social groups has become increasingly prominent in recent years. At the same time, individuals disagree about …","https://eprints.lse.ac.uk/68691/7/Sheehy-Skeffington_Hierarchy%20in%20the%20eye%20of%20the%20beholder.pdf","https://scholar.google.com/scholar?q=related:VTAB_bLULXwJ:scholar.google.com/&scioq=source:%22journal+of+personality+and+social+psychology%22&hl=en&as_sdt=0,5&as_ylo=2017&as_yhi=2017"
"28",134,"T Rogers, R Zeckhauser, F Gino, MI Norton…","Artful paltering: The risks and rewards of using truthful statements to mislead others.",2017,"… personality and social …","psycnet.apa.org","https://psycnet.apa.org/record/2016-59847-001","https://scholar.google.com/scholar?cites=8253655732068091679&as_sdt=2005&sciodt=0,5&hl=en",28,2023-08-22 15:47:17,NA,NA,NA,NA,NA,NA,NA,NA,134,22.33,27,5,6,"Paltering is the active use of truthful statements to convey a misleading impression. Across 2 pilot studies and 6 experiments, we identify paltering as a distinct form of deception …","https://www.hks.harvard.edu/sites/default/files/centers/mrcbg/files/mrcbg_fwp_2014-03_zeckhauser_paltering.pdf","https://scholar.google.com/scholar?q=related:HwdJmCjginIJ:scholar.google.com/&scioq=source:%22journal+of+personality+and+social+psychology%22&hl=en&as_sdt=0,5&as_ylo=2017&as_yhi=2017"
"29",127,"FJ Infurna, SS Luthar","The multidimensional nature of resilience to spousal loss.",2017,"… of Personality and Social Psychology","psycnet.apa.org","https://psycnet.apa.org/record/2016-33916-001","https://scholar.google.com/scholar?cites=11304448712464098591&as_sdt=2005&sciodt=0,5&hl=en",29,2023-08-22 15:47:17,NA,NA,NA,NA,NA,NA,NA,NA,127,21.17,64,2,6,"Spousal loss can be one of the most devastating events to occur across one's life, resulting in difficulties across different spheres of adjustment; yet, past research on resilience to …","https://psycnet.apa.org/manuscript/2016-33916-001.pdf","https://scholar.google.com/scholar?q=related:H2UL4DV44ZwJ:scholar.google.com/&scioq=source:%22journal+of+personality+and+social+psychology%22&hl=en&as_sdt=0,5&as_ylo=2017&as_yhi=2017"
