"","Cites","Authors","Title","Year","Source","Publisher","ArticleURL","CitesURL","GSRank","QueryDate","Type","DOI","ISSN","CitationURL","Volume","Issue","StartPage","EndPage","ECC","CitesPerYear","CitesPerAuthor","AuthorCount","Age","Abstract","FullTextURL","RelatedURL"
"216",20,"MA Reinka, CW Leach","Racialized images: Tracing appraisals of police force and protest.",2018,"… of personality and social psychology","psycnet.apa.org","https://psycnet.apa.org/record/2018-51567-001","https://scholar.google.com/scholar?cites=8187484592207703716&as_sdt=2005&sciodt=0,5&hl=en",88,2023-08-22 16:14:40,NA,NA,NA,NA,NA,NA,NA,NA,20,4,10,2,5,"As race acts as a social frame of reference, it should guide individual's appraisal of visual representations of social events and issues. Thus, grounded in Scherer's (2009) model of …","https://www.academia.edu/download/88829611/ReinkaLeach2018-Racialized-images.pdf","https://scholar.google.com/scholar?q=related:pC6GgtvJn3EJ:scholar.google.com/&scioq=source:%22journal+of+personality+and+social+psychology%22&hl=en&as_sdt=0,5&as_ylo=2018&as_yhi=2018"
"217",25,"I Olcaysoy Okten, GB Moskowitz","Goal versus trait explanations: Causal attributions beyond the trait-situation dichotomy.",2018,"Journal of Personality and Social …","psycnet.apa.org","https://psycnet.apa.org/record/2017-53608-001","https://scholar.google.com/scholar?cites=4603270659886546446&as_sdt=2005&sciodt=0,5&hl=en",89,2023-08-22 16:14:40,NA,NA,NA,NA,NA,NA,NA,NA,25,5,13,2,5,"In 4 studies, we show that two behavioral dimensions specified in Kelley's (1967) model of attribution, consistency and distinctiveness of behaviors, determine perceivers' likelihood to …",NA,"https://scholar.google.com/scholar?q=related:Dv6Dp0Ya4j8J:scholar.google.com/&scioq=source:%22journal+of+personality+and+social+psychology%22&hl=en&as_sdt=0,5&as_ylo=2018&as_yhi=2018"
"218",22,"CT Tadmor, Y Hong, MM Chao, ...","The tolerance benefits of multicultural experiences depend on the perception of available mental resources.",2018,"Journal of Personality and …","psycnet.apa.org","https://psycnet.apa.org/record/2018-34852-001","https://scholar.google.com/scholar?cites=15430645534023766585&as_sdt=2005&sciodt=0,5&hl=en",90,2023-08-22 16:14:40,NA,NA,NA,NA,NA,NA,NA,NA,22,4.4,6,4,5,"Abstract [Correction Notice: An Erratum for this article was reported in Vol 115 (3) of Journal of Personality and Social Psychology (see record 2018-40364-001). In the article, the …","https://drive.google.com/file/d/1ximRdEvIupLWqnri22qNYFlAZ_MzDvTO/view","https://scholar.google.com/scholar?q=related:OVJ0rluqJNYJ:scholar.google.com/&scioq=source:%22journal+of+personality+and+social+psychology%22&hl=en&as_sdt=0,5&as_ylo=2018&as_yhi=2018"
"219",25,"NA Lewis Jr, A Earl","Seeing more and eating less: Effects of portion size granularity on the perception and regulation of food consumption.",2018,"Journal of personality and social psychology","psycnet.apa.org","https://psycnet.apa.org/journals/psp/114/5/786/","https://scholar.google.com/scholar?cites=3944073944640841521&as_sdt=2005&sciodt=0,5&hl=en",91,2023-08-22 16:14:40,NA,NA,NA,NA,NA,NA,NA,NA,25,5,13,2,5,"Overeating and resulting obesity is a public health concern in the United States, and portion size is a factor that contributes to these problems (Zlatevska, Dubelaar, &Holden, 2014) …","https://sites.lsa.umich.edu/hailab/wp-content/uploads/sites/1035/2022/09/Lewis-Earl-2018.pdf","https://scholar.google.com/scholar?q=related:MecwJlsqvDYJ:scholar.google.com/&scioq=source:%22journal+of+personality+and+social+psychology%22&hl=en&as_sdt=0,5&as_ylo=2018&as_yhi=2018"
"220",23,"J Walker, JL Risen, T Gilovich, ...","Sudden-death aversion: Avoiding superior options because they feel riskier.",2018,"Journal of personality and …","psycnet.apa.org","https://psycnet.apa.org/record/2018-01584-001","https://scholar.google.com/scholar?cites=1674445804667292552&as_sdt=2005&sciodt=0,5&hl=en",92,2023-08-22 16:14:40,NA,NA,NA,NA,NA,NA,NA,NA,23,4.6,6,4,5,"We present evidence of sudden-death aversion (SDA)—the tendency to avoid “fast” strategies that provide a greater chance of success, but include the possibility of immediate …","https://content.tcmediasaffaires.com/LAF/lacom/SDA_final%20copy.pdf","https://scholar.google.com/scholar?q=related:iEvWdpbTPBcJ:scholar.google.com/&scioq=source:%22journal+of+personality+and+social+psychology%22&hl=en&as_sdt=0,5&as_ylo=2018&as_yhi=2018"
"221",22,"I Engeler, P Raghubir","Decomposing the cross-sex misprediction bias of dating behaviors: Do men overestimate or women underreport their sexual intentions?",2018,"… of Personality and Social Psychology","psycnet.apa.org","https://psycnet.apa.org/record/2017-30260-001","https://scholar.google.com/scholar?cites=3922142343301585702&as_sdt=2005&sciodt=0,5&hl=en",93,2023-08-22 16:14:40,NA,NA,NA,NA,NA,NA,NA,NA,22,4.4,11,2,5,"Men typically predict women's sexual intentions to be higher than women say they are (Haselton &Buss, 2000). It is debated whether this cross-sex bias is because of men …","https://people.stern.nyu.edu/raghubir/Decomposing%20Cross-Sex%20Bias%20JPSP%202017%20Proof.pdf","https://scholar.google.com/scholar?q=related:JlsCS64_bjYJ:scholar.google.com/&scioq=source:%22journal+of+personality+and+social+psychology%22&hl=en&as_sdt=0,5&as_ylo=2018&as_yhi=2018"
"222",21,"M Schaerer, M Schweinsberg, ...","Imaginary alternatives: The effects of mental simulation on powerless negotiators.",2018,"Journal of Personality and …","psycnet.apa.org","https://psycnet.apa.org/record/2018-13326-001","https://scholar.google.com/scholar?cites=7716378668495617410&as_sdt=2005&sciodt=0,5&hl=en",94,2023-08-22 16:14:40,NA,NA,NA,NA,NA,NA,NA,NA,21,4.2,7,3,5,"This research demonstrates that people can act more powerfully without having power. Researchers and practitioners advise people to obtain alternatives in social exchange …","https://ink.library.smu.edu.sg/cgi/viewcontent.cgi?article=6453&context=lkcsb_research","https://scholar.google.com/scholar?q=related:gj0VEIQVFmsJ:scholar.google.com/&scioq=source:%22journal+of+personality+and+social+psychology%22&hl=en&as_sdt=0,5&as_ylo=2018&as_yhi=2018"
"223",20,"BM Monroe, BL Koenig, KS Wan, T Laine, ...","Re-examining dominance of categories in impression formation: A test of dual-process models.",2018,"… personality and social …","psycnet.apa.org","https://psycnet.apa.org/record/2018-28950-001","https://scholar.google.com/scholar?cites=11785097180767131157&as_sdt=2005&sciodt=0,5&hl=en",95,2023-08-22 16:14:40,NA,NA,NA,NA,NA,NA,NA,NA,20,4,4,5,5,"We carried out tests of the first 2 premises of the Continuum Model (CM) of impression formation (Fiske &Neuberg, 1990). These premises predict that category information will in …","https://www.researchgate.net/profile/Andrew-Ortony/publication/322977364_Re-examining_Dominance_of_Categories_in_Impression_Formation_A_Test_of_Dual-process_Models/links/5b3fd387458515f71cad0048/Re-examining-Dominance-of-Categories-in-Impression-Formation-A-Test-of-Dual-process-Models.pdf","https://scholar.google.com/scholar?q=related:FRYVH3ITjaMJ:scholar.google.com/&scioq=source:%22journal+of+personality+and+social+psychology%22&hl=en&as_sdt=0,5&as_ylo=2018&as_yhi=2018"
"224",16,"EY Chou","Naysaying and negativity promote initial power establishment and leadership endorsement.",2018,"Journal of Personality and Social Psychology","psycnet.apa.org","https://psycnet.apa.org/journals/psp/115/4/638/","https://scholar.google.com/scholar?cites=10220141977909928688&as_sdt=2005&sciodt=0,5&hl=en",96,2023-08-22 16:14:40,NA,NA,NA,NA,NA,NA,NA,NA,16,3.2,16,1,5,"Conventional wisdom holds that leaders should behave in a supportive and positive manner. Yet the past decade has also seen a rise in naysayers' ascent to power. This …",NA,"https://scholar.google.com/scholar?q=related:8CJh8_o81Y0J:scholar.google.com/&scioq=source:%22journal+of+personality+and+social+psychology%22&hl=en&as_sdt=0,5&as_ylo=2018&as_yhi=2018"
"225",20,"DJ DelPriore, R Proffitt Leyva, BJ Ellis, ...","The effects of paternal disengagement on women's perceptions of male mating intent.",2018,"… of personality and social …","psycnet.apa.org","https://psycnet.apa.org/record/2017-47895-001","https://scholar.google.com/scholar?cites=11004942562795202466&as_sdt=2005&sciodt=0,5&hl=en",97,2023-08-22 16:14:40,NA,NA,NA,NA,NA,NA,NA,NA,20,4,5,4,5,"Previous research demonstrates reliable associations between low paternal investment and daughters' precocious and risky sexual behavior. However, little is known about the …","https://psycnet.apa.org/manuscript/2017-47895-001.pdf","https://scholar.google.com/scholar?q=related:oif8RPRouZgJ:scholar.google.com/&scioq=source:%22journal+of+personality+and+social+psychology%22&hl=en&as_sdt=0,5&as_ylo=2018&as_yhi=2018"
"226",18,"RP Bhargave, NV Montgomery, ...","Collective satiation: How coexperience accelerates a decline in hedonic judgments.",2018,"… of personality and social …","psycnet.apa.org","https://psycnet.apa.org/record/2018-13651-003","https://scholar.google.com/scholar?cites=8506136631855866421&as_sdt=2005&sciodt=0,5&hl=en",98,2023-08-22 16:14:40,NA,NA,NA,NA,NA,NA,NA,NA,18,3.6,6,3,5,"Individuals often mutually experience a stimulus with a relationship partner or social group (eg, snacking with friends). Yet, little is currently understood about how a sense of …","https://spiral.imperial.ac.uk/bitstream/10044/1/50419/2/Collective%20Satiation%202017-August-10%20TO%20SHARE.pdf","https://scholar.google.com/scholar?q=related:NeK0ADPeC3YJ:scholar.google.com/&scioq=source:%22journal+of+personality+and+social+psychology%22&hl=en&as_sdt=0,5&as_ylo=2018&as_yhi=2018"
"227",14,"NW Hudson, RC Fraley","Does attachment anxiety promote the encoding of false memories? An investigation of the processes linking adult attachment to memory errors.",2018,"… of personality and social psychology","psycnet.apa.org","https://psycnet.apa.org/record/2018-45703-005","https://scholar.google.com/scholar?cites=16084557821030082011&as_sdt=2005&sciodt=0,5&hl=en",99,2023-08-22 16:14:40,NA,NA,NA,NA,NA,NA,NA,NA,14,2.8,7,2,5,"Previous research has suggested that people's attachment styles influence memory processes. Most of this work has focused on the encoding and retrieval of information about …","https://www.nathanwhudson.com/vita/pdf/Hudson%20&%20Fraley,%202018b.pdf","https://scholar.google.com/scholar?q=related:26W6Wx7UN98J:scholar.google.com/&scioq=source:%22journal+of+personality+and+social+psychology%22&hl=en&as_sdt=0,5&as_ylo=2018&as_yhi=2018"
"228",13,"M Kardas, A Shaw, EM Caruso","How to give away your cake and eat it too: Relinquishing control prompts reciprocal generosity.",2018,"Journal of Personality and Social …","psycnet.apa.org","https://psycnet.apa.org/journals/psp/115/6/1054/","https://scholar.google.com/scholar?cites=16885241581731323506&as_sdt=2005&sciodt=0,5&hl=en",100,2023-08-22 16:14:40,NA,NA,NA,NA,NA,NA,NA,NA,13,2.6,4,3,5,"Many resource allocations confer two rewards, but these rewards typically work in opposition to one another: Reputational rewards come to those who give and material …","https://www.michaelkardas.com/s/Relinquishing-control.pdf","https://scholar.google.com/scholar?q=related:ch7AucFtVOoJ:scholar.google.com/&scioq=source:%22journal+of+personality+and+social+psychology%22&hl=en&as_sdt=0,5&as_ylo=2018&as_yhi=2018"
"229",14,"F Shaddy, A Fishbach","Eyes on the prize: The preference to invest resources in goals over means.",2018,"… of personality and social psychology","psycnet.apa.org","https://psycnet.apa.org/record/2018-45703-002","https://scholar.google.com/scholar?cites=6159048728237308128&as_sdt=2005&sciodt=0,5&hl=en",101,2023-08-22 16:14:40,NA,NA,NA,NA,NA,NA,NA,NA,14,2.8,7,2,5,"Goal systems are hierarchical, often requiring people to invest resources vertically—both in lower-order means and higher-order goals. For example, a college student who wants to …","https://www.ayeletfishbach.com/s/eyes-on-the-prize-the-preference-to-invest-resources-in-goals-over-means.pdf","https://scholar.google.com/scholar?q=related:4PjnsC9WeVUJ:scholar.google.com/&scioq=source:%22journal+of+personality+and+social+psychology%22&hl=en&as_sdt=0,5&as_ylo=2018&as_yhi=2018"
"230",17,"VH Fetvadjiev, D Meiring, ...","Personality and behavior prediction and consistency across cultures: A multimethod study of Blacks and Whites in South Africa.",2018,"… personality and social …","psycnet.apa.org","https://psycnet.apa.org/record/2017-02061-001","https://scholar.google.com/scholar?cites=12643434486980696400&as_sdt=2005&sciodt=0,5&hl=en",102,2023-08-22 16:14:40,NA,NA,NA,NA,NA,NA,NA,NA,17,3.4,6,3,5,"The cross-cultural universality of behavior's consistency and predictability from personality, assumed in trait models though challenged in cultural psychological models, has usually …",NA,"https://scholar.google.com/scholar?q=related:UFloma2Adq8J:scholar.google.com/&scioq=source:%22journal+of+personality+and+social+psychology%22&hl=en&as_sdt=0,5&as_ylo=2018&as_yhi=2018"
"231",14,"E Perinelli, G Alessandri, MB Donnellan, ...","State-trait decomposition of Name Letter Test scores and relationships with global self-esteem.",2018,"… and Social Psychology","psycnet.apa.org","https://psycnet.apa.org/record/2017-00748-001","https://scholar.google.com/scholar?cites=16109369054868337532&as_sdt=2005&sciodt=0,5&hl=en",103,2023-08-22 16:14:40,NA,NA,NA,NA,NA,NA,NA,NA,14,2.8,4,4,5,"Abstract The Name Letter Test (NLT) assesses the degree that participants show a preference for an individual's own initials. The NLT was often thought to measure implicit self …",NA,"https://scholar.google.com/scholar?q=related:fPMY5835j98J:scholar.google.com/&scioq=source:%22journal+of+personality+and+social+psychology%22&hl=en&as_sdt=0,5&as_ylo=2018&as_yhi=2018"
"232",10,"N Pino-James","Golden rules for engaging students in learning activities",2018,"Journal of Personality and Social Psychology","bepart.platoniq.net","https://bepart.platoniq.net/uploads/decidim/attachment/file/10/03._Golden_Rules_for_Engaging_Students_in_Learning_Activities.pdf","https://scholar.google.com/scholar?cites=5848397293703790556&as_sdt=2005&sciodt=0,5&hl=en",104,2023-08-22 16:14:40,"PDF",NA,NA,NA,NA,NA,NA,NA,10,2,10,1,5,"When we think of student engagement in learning activities, it is often convenient to understand engagement with an activity as being represented by good behavior (ie …","https://bepart.platoniq.net/uploads/decidim/attachment/file/10/03._Golden_Rules_for_Engaging_Students_in_Learning_Activities.pdf","https://scholar.google.com/scholar?q=related:3P-RPFquKVEJ:scholar.google.com/&scioq=source:%22journal+of+personality+and+social+psychology%22&hl=en&as_sdt=0,5&as_ylo=2018&as_yhi=2018"
"233",8,"B Zengel, BM Wells, JJ Skowronski","The waxing and waning of mnemic neglect.",2018,"Journal of Personality and …","psycnet.apa.org","https://psycnet.apa.org/record/2018-16714-004","https://scholar.google.com/scholar?cites=5096785475913066024&as_sdt=2005&sciodt=0,5&hl=en",105,2023-08-22 16:14:40,NA,NA,NA,NA,NA,NA,NA,NA,8,1.6,3,3,5,"The mechanisms underlying mnemic neglect (MN) and the conditions under which it waxes and wanes are not yet fully understood. The research in this article examined conditions …","https://repository.essex.ac.uk/26189/1/2018_Waxing_and_Waning_of_Mnemic_Neglect_JPSP.pdf","https://scholar.google.com/scholar?q=related:KCYr7GJru0YJ:scholar.google.com/&scioq=source:%22journal+of+personality+and+social+psychology%22&hl=en&as_sdt=0,5&as_ylo=2018&as_yhi=2018"
"234",5,"M Koren","The three kinds of people who live in the United States",2018,"Journal of Personality and Social Psychology",NA,NA,"https://scholar.google.com/scholar?cites=16441363568032898445&as_sdt=2005&sciodt=0,5&hl=en",106,2023-08-22 16:14:40,"CITATION",NA,NA,NA,NA,NA,NA,NA,5,1,5,1,5,NA,NA,"https://scholar.google.com/scholar?q=related:jV2mFw51K-QJ:scholar.google.com/&scioq=source:%22journal+of+personality+and+social+psychology%22&hl=en&as_sdt=0,5&as_ylo=2018&as_yhi=2018"
"235",4,"WM Hall, T Schmader, A Aday, M Inness, E Croft","Climate control: cultural predictors of social identity threat for women in engineering",2018,"… Personality and Social Psychology",NA,NA,"https://scholar.google.com/scholar?cites=9414293386375278008&as_sdt=2005&sciodt=0,5&hl=en",107,2023-08-22 16:14:40,"CITATION",NA,NA,NA,NA,NA,NA,NA,4,0.8,1,5,5,NA,NA,"https://scholar.google.com/scholar?q=related:uC01svRJpoIJ:scholar.google.com/&scioq=source:%22journal+of+personality+and+social+psychology%22&hl=en&as_sdt=0,5&as_ylo=2018&as_yhi=2018"
"236",3,"J Deventer, J Wagner, O Lüdtke, U Trautwein","Are personality traits and relationship characteristics reciprocally related in emerging adulthood? Longitudinal analyses of codevelopment in the transition …",2018,"… of Personality and Social Psychology",NA,NA,"https://scholar.google.com/scholar?cites=18308395932171914395&as_sdt=2005&sciodt=0,5&hl=en",108,2023-08-22 16:14:40,"CITATION",NA,NA,NA,NA,NA,NA,NA,3,0.6,1,4,5,NA,NA,"https://scholar.google.com/scholar?q=related:m0xQKBl9FP4J:scholar.google.com/&scioq=source:%22journal+of+personality+and+social+psychology%22&hl=en&as_sdt=0,5&as_ylo=2018&as_yhi=2018"
"237",3,"T Schwaba, W Bleidorn","Personality development across the transition to retirement",2018,"Journal of Personality and Social Psychology",NA,NA,"https://scholar.google.com/scholar?cites=5854151859075914042&as_sdt=2005&sciodt=0,5&hl=en",109,2023-08-22 16:14:40,"CITATION",NA,NA,NA,NA,NA,NA,NA,3,0.6,2,2,5,NA,NA,"https://scholar.google.com/scholar?q=related:OplpZRkgPlEJ:scholar.google.com/&scioq=source:%22journal+of+personality+and+social+psychology%22&hl=en&as_sdt=0,5&as_ylo=2018&as_yhi=2018"
"238",2,"M Gerald, F Perales","Using relation-focused intervention to enhance the social emotional functioning of young children with autism",2018,"Journal of Personality and Social Psychology",NA,NA,"https://scholar.google.com/scholar?cites=17821892470459390565&as_sdt=2005&sciodt=0,5&hl=en",110,2023-08-22 16:14:40,"CITATION",NA,NA,NA,NA,NA,NA,NA,2,0.4,1,2,5,NA,NA,"https://scholar.google.com/scholar?q=related:ZdrwBscUVPcJ:scholar.google.com/&scioq=source:%22journal+of+personality+and+social+psychology%22&hl=en&as_sdt=0,5&as_ylo=2018&as_yhi=2018"
"239",2,"D Anderson","Investigating the factors affecting work-life balance",2018,"Journal of Personality and Social Psychology",NA,NA,"https://scholar.google.com/scholar?cites=14177758301526092071&as_sdt=2005&sciodt=0,5&hl=en",111,2023-08-22 16:14:40,"CITATION",NA,NA,NA,NA,NA,NA,NA,2,0.4,2,1,5,NA,NA,"https://scholar.google.com/scholar?q=related:J-nO6Q6EwcQJ:scholar.google.com/&scioq=source:%22journal+of+personality+and+social+psychology%22&hl=en&as_sdt=0,5&as_ylo=2018&as_yhi=2018"
"240",2,"WC Williams, SA Morelli, ...","Interpersonal Emotion Regulation: Implications for Affiliation, Perceived Support, Relationships, and Well-Being (vol 115, pg 224, 2018)",2018,"… of Personality …","AMER PSYCHOLOGICAL ASSOC …",NA,"https://scholar.google.com/scholar?cites=13355800942601482606&as_sdt=2005&sciodt=0,5&hl=en",112,2023-08-22 16:14:40,"CITATION",NA,NA,NA,NA,NA,NA,NA,2,0.4,1,3,5,NA,NA,"https://scholar.google.com/scholar?q=related:brGW-jFWWbkJ:scholar.google.com/&scioq=source:%22journal+of+personality+and+social+psychology%22&hl=en&as_sdt=0,5&as_ylo=2018&as_yhi=2018"
"241",2,"D Cohen, E Kim, NW Hudson","Religion, repulsion, and reaction formation: Transforming repellent attractions and repulsions.",2018,"… personality and social psychology","psycnet.apa.org","https://psycnet.apa.org/record/2017-25568-001","https://scholar.google.com/scholar?cites=8537399040232505459&as_sdt=2005&sciodt=0,5&hl=en",113,2023-08-22 16:14:40,NA,NA,NA,NA,NA,NA,NA,NA,2,0.4,1,3,5,"Protestants were more likely than non-Protestants to demonstrate phenomena consistent with the use of reaction formation. Lab experiments showed that when manipulations were …","https://www.nathanwhudson.com/vita/pdf/Cohen%20et%20al.,%202018.pdf","https://scholar.google.com/scholar?q=related:c8DRqjHvenYJ:scholar.google.com/&scioq=source:%22journal+of+personality+and+social+psychology%22&hl=en&as_sdt=0,5&as_ylo=2018&as_yhi=2018"
"242",2,"K Hoff, CQ Song, S Einarsdóttir, DA Briley, J Rounds","Developmental structure of personality and interests: A 4-wave, 8-year longitudinal study",2018,"Journal of Personality and …",NA,NA,"https://scholar.google.com/scholar?cites=1412836168539864357&as_sdt=2005&sciodt=0,5&hl=en",114,2023-08-22 16:14:40,"CITATION",NA,NA,NA,NA,NA,NA,NA,2,0.4,0,5,5,NA,NA,"https://scholar.google.com/scholar?q=related:JX2kfwJnmxMJ:scholar.google.com/&scioq=source:%22journal+of+personality+and+social+psychology%22&hl=en&as_sdt=0,5&as_ylo=2018&as_yhi=2018"
"243",1,"L Wolf, N Weinstein, G Maio","Anti-immigrant prejudice: Understanding the roles of (perceived) human values and value dissimilarity",2018,"… of Personality …","American Psychological Association",NA,"https://scholar.google.com/scholar?cites=14056719429232210857&as_sdt=2005&sciodt=0,5&hl=en",115,2023-08-22 16:14:40,"CITATION",NA,NA,NA,NA,NA,NA,NA,1,0.2,0,3,5,NA,NA,"https://scholar.google.com/scholar?q=related:qbO3Xth_E8MJ:scholar.google.com/&scioq=source:%22journal+of+personality+and+social+psychology%22&hl=en&as_sdt=0,5&as_ylo=2018&as_yhi=2018"
"244",1,"D Webber, M Babush, N Schori-Eyal, ...","Political Belief Scale",2018,"Journal of Personality …","psycnet.apa.org","https://psycnet.apa.org/getdoi.cfm?doi=10.1037/t65993-000","https://scholar.google.com/scholar?cites=7164465663831368406&as_sdt=2005&sciodt=0,5&hl=en",116,2023-08-22 16:14:40,NA,"10.1037/t65993-000",NA,NA,NA,NA,NA,NA,1,0.2,0,4,5,"Developed in a study that examined the hypothesis that loss of personal significance fuels extremism via the need for cognitive closure, the Political Belief Scale (Webber et al., 2018) …",NA,"https://scholar.google.com/scholar?q=related:1uIm8o9LbWMJ:scholar.google.com/&scioq=source:%22journal+of+personality+and+social+psychology%22&hl=en&as_sdt=0,5&as_ylo=2018&as_yhi=2018"
"245",0,"JC Deska, EP Lloyd, ...","Facing Humanness: Facial Width-to-Height Ratio Predicts Ascriptions of Humanity (vol 114, pg 75, 2017)",2018,"JOURNAL OF …","AMER PSYCHOLOGICAL ASSOC …",NA,NA,117,2023-08-22 16:14:40,"CITATION",NA,NA,NA,NA,NA,NA,NA,0,0,0,3,5,NA,NA,"https://scholar.google.com/scholar?q=related:vFXCgVRjmsUJ:scholar.google.com/&scioq=source:%22journal+of+personality+and+social+psychology%22&hl=en&as_sdt=0,5&as_ylo=2018&as_yhi=2018"
"246",29,"WHO Newborns","Reducing mortality",2018,"Journal of Personality and Social Psychology [Internet]",NA,NA,"https://scholar.google.com/scholar?cites=14133176206629169683&as_sdt=2005&sciodt=0,5&hl=en",119,2023-08-22 16:14:40,"CITATION",NA,NA,NA,NA,NA,NA,NA,29,5.8,29,1,5,NA,NA,"https://scholar.google.com/scholar?q=related:E2oiEOEgI8QJ:scholar.google.com/&scioq=source:%22journal+of+personality+and+social+psychology%22&hl=en&as_sdt=0,5&as_ylo=2018&as_yhi=2018"
"247",0,"DD Hutto, I Robertson, MD Kirchhoff","A New, Better BET: Rescuing Basic Emotion Theory",2018,"Journal of Personality and Social Psychology",NA,NA,NA,118,2023-08-22 16:14:40,"CITATION",NA,NA,NA,NA,NA,NA,NA,0,0,0,3,NA,NA,NA,"https://scholar.google.com/scholar?q=related:lWVYVqD_BzsJ:scholar.google.com/&scioq=source:%22journal+of+personality+and+social+psychology%22&hl=en&as_sdt=0,5&as_ylo=2018&as_yhi=2018"
"248",716,"PS Forscher, CK Lai, JR Axt, CR Ebersole…","A meta-analysis of procedures to change implicit measures.",2019,"… personality and social …","psycnet.apa.org","https://psycnet.apa.org/record/2019-31306-001","https://scholar.google.com/scholar?cites=3258490864008110900&as_sdt=2005&sciodt=0,5&hl=en",1,2023-08-22 16:33:57,NA,NA,NA,NA,NA,NA,NA,NA,716,179,143,5,4,"Using a novel technique known as network meta-analysis, we synthesized evidence from 492 studies (87,418 participants) to investigate the effectiveness of procedures in changing …","https://psycnet.apa.org/manuscript/2019-31306-001.pdf","https://scholar.google.com/scholar?q=related:NCMPNS18OC0J:scholar.google.com/&scioq=source:%22journal+of+personality+and+social+psychology%22&hl=en&as_sdt=0,5&as_ylo=2019&as_yhi=2019"
"249",320,"L Caviola, JAC Everett, NS Faber","The moral standing of animals: Towards a psychology of speciesism.",2019,"Journal of personality and …","psycnet.apa.org","https://psycnet.apa.org/record/2018-09974-001","https://scholar.google.com/scholar?cites=84489279701773322&as_sdt=2005&sciodt=0,5&hl=en",2,2023-08-22 16:33:57,NA,NA,NA,NA,NA,NA,NA,NA,320,80,107,3,4,"We introduce and investigate the philosophical concept of 'speciesism'—the assignment of different moral worth based on species membership—as a psychological construct. In five …","https://ora.ox.ac.uk/objects/uuid:2feadf1a-8d3f-4030-946e-a524495b385a/download_file?file_format=pdf&hyrax_fileset_id=me23b4d171269b3737c8cd72fad615498&safe_filename=Caviola%2C%2BEverett%2Band%2BFaber%2B%282018%29%2BSpeciesism%2BJPSP%2BPre-Print.pdf&type_of_work=Journal+article","https://scholar.google.com/scholar?q=related:CuzzX40qLAEJ:scholar.google.com/&scioq=source:%22journal+of+personality+and+social+psychology%22&hl=en&as_sdt=0,5&as_ylo=2019&as_yhi=2019"
"250",252,"RI Damian, M Spengler, A Sutu…","Sixteen going on sixty-six: A longitudinal study of personality stability and change across 50 years.",2019,"… of Personality and Social …","psycnet.apa.org","https://psycnet.apa.org/record/2018-39707-001","https://scholar.google.com/scholar?cites=18138680588499734941&as_sdt=2005&sciodt=0,5&hl=en",3,2023-08-22 16:33:57,NA,NA,NA,NA,NA,NA,NA,NA,252,63,63,4,4,"How much do people's personalities change or remain stable from high school to retirement? To address these questions, we used a large US sample (N= 1,795) that …","https://psyarxiv.com/dmq5g/download","https://scholar.google.com/scholar?q=related:ndHMc-SJufsJ:scholar.google.com/&scioq=source:%22journal+of+personality+and+social+psychology%22&hl=en&as_sdt=0,5&as_ylo=2019&as_yhi=2019"
