"","Cites","Authors","Title","Year","Source","Publisher","ArticleURL","CitesURL","GSRank","QueryDate","Type","DOI","ISSN","CitationURL","Volume","Issue","StartPage","EndPage","ECC","CitesPerYear","CitesPerAuthor","AuthorCount","Age","Abstract","FullTextURL","RelatedURL"
"431",36,"JP Lilgendahl, KC McLean","Narrative identity processes and patterns of adjustment across the transition to college: A developmentally contextualized approach.",2020,"… of personality and social psychology","psycnet.apa.org","https://psycnet.apa.org/record/2019-77325-001","https://scholar.google.com/scholar?cites=12866351447793869494&as_sdt=2005&sciodt=0,5&hl=en",57,2023-08-22 17:17:06,NA,NA,NA,NA,NA,NA,NA,NA,36,12,18,2,3,"Narrative identity is a distinct level of personality that is related to psychological adjustment across the life course and is at its height of development during the emerging adult years …","https://psycnet.apa.org/manuscript/2019-77325-001.pdf","https://scholar.google.com/scholar?q=related:tiIWEXl2jrIJ:scholar.google.com/&scioq=source:%22journal+of+personality+and+social+psychology%22&hl=en&as_sdt=0,5&as_ylo=2020&as_yhi=2020"
"432",37,"JG Lu, XL Liu, H Liao, L Wang","Disentangling stereotypes from social reality: Astrological stereotypes and discrimination in China.",2020,"… Personality and Social Psychology","psycnet.apa.org","https://psycnet.apa.org/journals/psp/119/6/1359/","https://scholar.google.com/scholar?cites=6384256639172002465&as_sdt=2005&sciodt=0,5&hl=en",58,2023-08-22 17:17:06,NA,NA,NA,NA,NA,NA,NA,NA,37,12.33,9,4,3,"Because stereotypes and social reality are mutually reinforcing, it is often unclear whether a given stereotype has emerged from preexisting social reality, or has shaped social reality …","https://gosling.psy.utexas.edu/wp-content/uploads/2020/03/Lu-et-al.-2020-Disentangling-stereotypes-from-social-reality-Astrological-stereotypes-and-discrimination-in-China-JPSP.pdf","https://scholar.google.com/scholar?q=related:ocLGjJZvmVgJ:scholar.google.com/&scioq=source:%22journal+of+personality+and+social+psychology%22&hl=en&as_sdt=0,5&as_ylo=2020&as_yhi=2020"
"433",35,"NC Overall","Behavioral variability reduces the harmful longitudinal effects of partners' negative-direct behavior on relationship problems.",2020,"Journal of Personality and Social Psychology","psycnet.apa.org","https://psycnet.apa.org/record/2020-04481-001","https://scholar.google.com/scholar?cites=3192980584480320043&as_sdt=2005&sciodt=0,5&hl=en",59,2023-08-22 17:17:06,NA,NA,NA,NA,NA,NA,NA,NA,35,11.67,35,1,3,"Based on growing evidence that negative-direct behavior that addresses important contextual and situational demands is less harmful than negative-direct behavior that occurs …",NA,"https://scholar.google.com/scholar?q=related:KyqrqOy-TywJ:scholar.google.com/&scioq=source:%22journal+of+personality+and+social+psychology%22&hl=en&as_sdt=0,5&as_ylo=2020&as_yhi=2020"
"434",32,"NP Leander, M Agostini, W Stroebe…","Frustration-affirmation? Thwarted goals motivate compliance with social norms for violence and nonviolence.",2020,"… personality and social …","psycnet.apa.org","https://psycnet.apa.org/journals/psp/119/2/249/","https://scholar.google.com/scholar?cites=17531518517554842042&as_sdt=2005&sciodt=0,5&hl=en",60,2023-08-22 17:17:06,NA,NA,NA,NA,NA,NA,NA,NA,32,10.67,8,4,3,"When thwarted goals increase endorsement of violence, it may not always reflect antisocial tendencies or some breakdown of self-regulation per se; such responses can also reflect an …","https://research.rug.nl/files/132372120/ContentServer_8_.pdf","https://scholar.google.com/scholar?q=related:ugkKrDR3TPMJ:scholar.google.com/&scioq=source:%22journal+of+personality+and+social+psychology%22&hl=en&as_sdt=0,5&as_ylo=2020&as_yhi=2020"
"435",36,"A Hufer, AE Kornadt, C Kandler…","Genetic and environmental variation in political orientation in adolescence and early adulthood: A Nuclear Twin Family analysis.",2020,"… of Personality and Social …","psycnet.apa.org","https://psycnet.apa.org/record/2019-35869-001","https://scholar.google.com/scholar?cites=14890016271289087878&as_sdt=2005&sciodt=0,5&hl=en",61,2023-08-22 17:17:06,NA,NA,NA,NA,NA,NA,NA,NA,36,12,9,4,3,"Political orientation is often assumed to be shaped by socialization processes; however, previous studies have shown substantial genetic variance components in party affiliation …",NA,"https://scholar.google.com/scholar?q=related:hvf4dej2o84J:scholar.google.com/&scioq=source:%22journal+of+personality+and+social+psychology%22&hl=en&as_sdt=0,5&as_ylo=2020&as_yhi=2020"
"436",46,"SC Matz, JJ Gladstone","Nice guys finish last: When and why agreeableness is associated with economic hardship.",2020,"… of Personality and Social Psychology","psycnet.apa.org","https://psycnet.apa.org/record/2018-51040-001","https://scholar.google.com/scholar?cites=1884640721476771682&as_sdt=2005&sciodt=0,5&hl=en",62,2023-08-22 17:17:06,NA,NA,NA,NA,NA,NA,NA,NA,46,15.33,23,2,3,"Recent research suggests that agreeable individuals experience greater financial hardship than their less agreeable peers. We explore the psychological mechanisms underlying this …","https://www.apa.org/pubs/journals/releases/psp-pspp0000220.pdf","https://scholar.google.com/scholar?q=related:Yt_bPMCWJxoJ:scholar.google.com/&scioq=source:%22journal+of+personality+and+social+psychology%22&hl=en&as_sdt=0,5&as_ylo=2020&as_yhi=2020"
"437",46,"F Danbold, MM Unzueta","Drawing the diversity line: Numerical thresholds of diversity vary by group status.",2020,"… of Personality and Social Psychology","psycnet.apa.org","https://psycnet.apa.org/journals/psp/118/2/283/","https://scholar.google.com/scholar?cites=14242133642071212388&as_sdt=2005&sciodt=0,5&hl=en",63,2023-08-22 17:17:06,NA,NA,NA,NA,NA,NA,NA,NA,46,15.33,23,2,3,"This research estimates the points of relative group representation at which members of dominant and nondominant groups declare an organization to be diverse. Across 7 studies …","http://www.felixdanbold.com/s/Danbold-Unzueta-2019.pdf","https://scholar.google.com/scholar?q=related:ZIFL4xY5psUJ:scholar.google.com/&scioq=source:%22journal+of+personality+and+social+psychology%22&hl=en&as_sdt=0,5&as_ylo=2020&as_yhi=2020"
"438",34,"M Mund, O Lüdtke, FJ Neyer","Owner of a lonely heart: The stability of loneliness across the life span.",2020,"… Personality and Social Psychology","psycnet.apa.org","https://psycnet.apa.org/record/2019-57569-001","https://scholar.google.com/scholar?cites=8792317929729192627&as_sdt=2005&sciodt=0,5&hl=en",64,2023-08-22 17:17:06,NA,NA,NA,NA,NA,NA,NA,NA,34,11.33,11,3,3,"Individuals feel lonely when they perceive a discrepancy between their aspired and their actually experienced amount of closeness and intimacy in social relationships. In the …",NA,"https://scholar.google.com/scholar?q=related:s3LOyZKWBHoJ:scholar.google.com/&scioq=source:%22journal+of+personality+and+social+psychology%22&hl=en&as_sdt=0,5&as_ylo=2020&as_yhi=2020"
"439",34,"MJ Hornsey, MJA Wohl, EA Harris…","Embodied remorse: Physical displays of remorse increase positive responses to public apologies, but have negligible effects on forgiveness.",2020,"… personality and social …","psycnet.apa.org","https://psycnet.apa.org/record/2019-54512-001","https://scholar.google.com/scholar?cites=11495323740047654875&as_sdt=2005&sciodt=0,5&hl=en",65,2023-08-22 17:17:06,NA,NA,NA,NA,NA,NA,NA,NA,34,11.33,9,4,3,"Public apologies struggle to communicate genuineness. Previous studies have shown that, in response to public apologies, perceptions of remorse and levels of forgiveness are often …",NA,"https://scholar.google.com/scholar?q=related:27-nZwmYh58J:scholar.google.com/&scioq=source:%22journal+of+personality+and+social+psychology%22&hl=en&as_sdt=0,5&as_ylo=2020&as_yhi=2020"
"440",37,"MA Van Scheppingen, T Leopold","Trajectories of life satisfaction before, upon, and after divorce: Evidence from a new matching approach.",2020,"Journal of Personality and …","psycnet.apa.org","https://psycnet.apa.org/record/2019-59139-001","https://scholar.google.com/scholar?cites=2388241351887059850&as_sdt=2005&sciodt=0,5&hl=en",66,2023-08-22 17:17:06,NA,NA,NA,NA,NA,NA,NA,NA,37,12.33,19,2,3,"The aim of the current study was to compare changes in divorcees' life satisfaction to changes in a control sample of nondivorcees. Prospective longitudinal data came from 33 …",NA,"https://scholar.google.com/scholar?q=related:insgKdu8JCEJ:scholar.google.com/&scioq=source:%22journal+of+personality+and+social+psychology%22&hl=en&as_sdt=0,5&as_ylo=2020&as_yhi=2020"
"441",33,"K O'Connor, DA Effron, BJ Lucas","Moral cleansing as hypocrisy: When private acts of charity make you feel better than you deserve.",2020,"Journal of personality and …","psycnet.apa.org","https://psycnet.apa.org/record/2020-28138-001","https://scholar.google.com/scholar?cites=3890947009029747257&as_sdt=2005&sciodt=0,5&hl=en",67,2023-08-22 17:17:06,NA,NA,NA,NA,NA,NA,NA,NA,33,11,11,3,3,"What counts as hypocrisy? Current theorizing emphasizes that people see hypocrisy when an individual sends them “false signals” about his or her morality (Jordan, Sommers, Bloom …","https://lbsresearch.london.edu/id/eprint/1398/1/O%27Connor%20Effron%20Lucas%20JPSP%20%282020%29%20hypocrisy.pdf","https://scholar.google.com/scholar?q=related:OTIWibBr_zUJ:scholar.google.com/&scioq=source:%22journal+of+personality+and+social+psychology%22&hl=en&as_sdt=0,5&as_ylo=2020&as_yhi=2020"
"442",47,"NM Wessels, J Zimmermann, JC Biesanz…","Differential associations of knowing and liking with accuracy and positivity bias in person perception.",2020,"… and Social Psychology","psycnet.apa.org","https://psycnet.apa.org/record/2018-51575-001","https://scholar.google.com/scholar?cites=7165217565921208110&as_sdt=2005&sciodt=0,5&hl=en",68,2023-08-22 17:17:06,NA,NA,NA,NA,NA,NA,NA,NA,47,15.67,12,4,3,"A great range of person perception phenomena may be conceptualized in terms of how much perceivers know about the targets, how much they like the targets, and how these …","https://osf.io/uxrcg/download","https://scholar.google.com/scholar?q=related:Lmcfy2n3b2MJ:scholar.google.com/&scioq=source:%22journal+of+personality+and+social+psychology%22&hl=en&as_sdt=0,5&as_ylo=2020&as_yhi=2020"
"443",31,"T Ebert, JE Gebauer, JR Talman…","Religious people only live longer in religious cultural contexts: A gravestone analysis.",2020,"… of Personality and Social …","psycnet.apa.org","https://psycnet.apa.org/journals/psp/119/1/1/","https://scholar.google.com/scholar?cites=12394365047806371193&as_sdt=2005&sciodt=0,5&hl=en",69,2023-08-22 17:17:06,NA,NA,NA,NA,NA,NA,NA,NA,31,10.33,8,4,3,"Religious people live longer than nonreligious people, according to a staple of social science research. Yet, are those longevity benefits an inherent feature of religiosity? To find …","https://www.researchgate.net/profile/Tobias-Ebert-3/publication/339157772_Religious_People_Only_Live_Longer_in_Religious_Cultural_Contexts_A_Gravestone_Analysis/links/5e9d77d14585150839ec2f96/Religious-People-Only-Live-Longer-in-Religious-Cultural-Contexts-A-Gravestone-Analysis.pdf","https://scholar.google.com/scholar?q=related:eSUEw1ehAawJ:scholar.google.com/&scioq=source:%22journal+of+personality+and+social+psychology%22&hl=en&as_sdt=0,5&as_ylo=2020&as_yhi=2020"
"444",43,"OE Atherton, KM Lawson, E Ferrer…","The role of effortful control in the development of ADHD, ODD, and CD symptoms.",2020,"… of personality and social …","psycnet.apa.org","https://psycnet.apa.org/record/2019-16899-001","https://scholar.google.com/scholar?cites=11158152897521305937&as_sdt=2005&sciodt=0,5&hl=en",70,2023-08-22 17:17:06,NA,NA,NA,NA,NA,NA,NA,NA,43,14.33,11,4,3,"Many adolescents have difficulty regulating their impulses and become prone to externalizing problems (eg, attention-deficit/hyperactivity disorder [ADHD], oppositional …","https://psycnet.apa.org/manuscript/2019-16899-001.pdf","https://scholar.google.com/scholar?q=related:UclAHvG42ZoJ:scholar.google.com/&scioq=source:%22journal+of+personality+and+social+psychology%22&hl=en&as_sdt=0,5&as_ylo=2020&as_yhi=2020"
"445",33,"T Jiang, Z Chen, C Sedikides","Self-concept clarity lays the foundation for self-continuity: The restorative function of autobiographical memory.",2020,"… Personality and Social Psychology","psycnet.apa.org","https://psycnet.apa.org/record/2019-41525-001","https://scholar.google.com/scholar?cites=16958268215792413488&as_sdt=2005&sciodt=0,5&hl=en",71,2023-08-22 17:17:06,NA,NA,NA,NA,NA,NA,NA,NA,33,11,11,3,3,"Abstract [Correction Notice: An Erratum for this article was reported online in Journal of Personality and Social Psychology on Sep 9 2019 (see record 2019-54516-001). In the …","https://eprints.soton.ac.uk/432225/1/Jiang_Chen_Sedikides_2019_JPSP.docx","https://scholar.google.com/scholar?q=related:MKsa8BffV-sJ:scholar.google.com/&scioq=source:%22journal+of+personality+and+social+psychology%22&hl=en&as_sdt=0,5&as_ylo=2020&as_yhi=2020"
"446",41,"F Bai, GCC Ho, J Yan","Does virtue lead to status? Testing the moral virtue theory of status attainment.",2020,"… of Personality and Social Psychology","psycnet.apa.org","https://psycnet.apa.org/record/2019-27721-001","https://scholar.google.com/scholar?cites=3884604005857099781&as_sdt=2005&sciodt=0,5&hl=en",72,2023-08-22 17:17:06,NA,NA,NA,NA,NA,NA,NA,NA,41,13.67,14,3,3,"Abstract [Correction Notice: An Erratum for this article was reported online in Journal of Personality and Social Psychology on Oct 24 2019 (see record 2019-63656-001). In the …",NA,"https://scholar.google.com/scholar?q=related:BQAsBsPi6DUJ:scholar.google.com/&scioq=source:%22journal+of+personality+and+social+psychology%22&hl=en&as_sdt=0,5&as_ylo=2020&as_yhi=2020"
"447",26,"F Gino, M Kouchaki, T Casciaro","Why connect? Moral consequences of networking with a promotion or prevention focus.",2020,"… personality and social psychology","psycnet.apa.org","https://psycnet.apa.org/record/2020-42384-001","https://scholar.google.com/scholar?cites=13090467418371316418&as_sdt=2005&sciodt=0,5&hl=en",73,2023-08-22 17:17:06,NA,NA,NA,NA,NA,NA,NA,NA,26,8.67,9,3,3,"Networks are a key source of social capital for achieving goals in professional and personal settings. Yet, despite the clear benefits of having an extensive network, individuals often shy …","https://francescagino.com/s/Gino-et-al-2020-Why-Connect.pdf","https://scholar.google.com/scholar?q=related:wtrYv8KuqrUJ:scholar.google.com/&scioq=source:%22journal+of+personality+and+social+psychology%22&hl=en&as_sdt=0,5&as_ylo=2020&as_yhi=2020"
"448",43,"R Meleady, RJ Crisp, K Dhont, T Hopthrow…","Intergroup contact, social dominance, and environmental concern: A test of the cognitive-liberalization hypothesis.",2020,"… personality and social …","psycnet.apa.org","https://psycnet.apa.org/journals/psp/118/6/1146/","https://scholar.google.com/scholar?cites=15784961192618375342&as_sdt=2005&sciodt=0,5&hl=en",74,2023-08-22 17:17:06,NA,NA,NA,NA,NA,NA,NA,NA,43,14.33,9,5,3,"Intergroup contact is among the most effective ways to improve intergroup attitudes. Although it is now beyond any doubt that contact can reduce prejudice, in this article we …","https://kar.kent.ac.uk/73713/1/ACCEPTED%20JPSP%20Meleady%20et%20al.pdf","https://scholar.google.com/scholar?q=related:rjhYh5JyD9sJ:scholar.google.com/&scioq=source:%22journal+of+personality+and+social+psychology%22&hl=en&as_sdt=0,5&as_ylo=2020&as_yhi=2020"
"449",39,"LK Kammrath, BF Armstrong III, SP Lane…","What predicts who we approach for social support? Tests of the attachment figure and strong ties hypotheses.",2020,"Journal of Personality …","psycnet.apa.org","https://psycnet.apa.org/record/2019-25117-001","https://scholar.google.com/scholar?cites=15573128317222550171&as_sdt=2005&sciodt=0,5&hl=en",75,2023-08-22 17:17:06,NA,NA,NA,NA,NA,NA,NA,NA,39,13,10,4,3,"Before people seek support for an issue, they must choose whom in their support network to approach. Two prominent supporter-selection hypotheses are the attachment figure …",NA,"https://scholar.google.com/scholar?q=related:m3qgzbHdHtgJ:scholar.google.com/&scioq=source:%22journal+of+personality+and+social+psychology%22&hl=en&as_sdt=0,5&as_ylo=2020&as_yhi=2020"
"450",40,"PD Joshi, CJ Wakslak, G Appel…","Gender differences in communicative abstraction.",2020,"Journal of personality and …","psycnet.apa.org","https://psycnet.apa.org/journals/psp/118/3/417/","https://scholar.google.com/scholar?cites=11468791886490538487&as_sdt=2005&sciodt=0,5&hl=en",76,2023-08-22 17:17:06,NA,NA,NA,NA,NA,NA,NA,NA,40,13.33,10,4,3,"Drawing on construal level theory, which suggests that experiencing a communicative audience as proximal rather than distal leads speakers to frame messages more concretely …",NA,"https://scholar.google.com/scholar?q=related:95Em3XRVKZ8J:scholar.google.com/&scioq=source:%22journal+of+personality+and+social+psychology%22&hl=en&as_sdt=0,5&as_ylo=2020&as_yhi=2020"
"451",31,"FJ Kachanoff, NS Kteily, TH Khullar…","Determining our destiny: Do restrictions to collective autonomy fuel collective action?",2020,"… personality and social …","psycnet.apa.org","https://psycnet.apa.org/record/2019-57749-001","https://scholar.google.com/scholar?cites=2253249756367403987&as_sdt=2005&sciodt=0,5&hl=en",77,2023-08-22 17:17:06,NA,NA,NA,NA,NA,NA,NA,NA,31,10.33,8,4,3,"Groups experience collective autonomy restriction whenever they perceive that other groups attempt to limit the freedom of their group to determine and express its own identity. We …","https://www.hyunjoonpark.net/uploads/1/3/9/0/139091848/kachanoffkteilyetal2020-determiningourdestiny_1.pdf","https://scholar.google.com/scholar?q=related:07uDFrcmRR8J:scholar.google.com/&scioq=source:%22journal+of+personality+and+social+psychology%22&hl=en&as_sdt=0,5&as_ylo=2020&as_yhi=2020"
"452",47,"SC Rudert, MD Keller, AH Hales, M Walker…","Who gets ostracized? A personality perspective on risk and protective factors of ostracism.",2020,"Journal of Personality …","psycnet.apa.org","https://psycnet.apa.org/record/2019-60517-001","https://scholar.google.com/scholar?cites=11794866579442316724&as_sdt=2005&sciodt=0,5&hl=en",78,2023-08-22 17:17:06,NA,NA,NA,NA,NA,NA,NA,NA,47,15.67,9,5,3,"Ostracism, excluding and ignoring others, results from a variety of factors. Here, we investigate the effect of personality on the likelihood of becoming a target of ostracism …","https://edoc.unibas.ch/73528/1/Who%20gets%20ostracized.pdf","https://scholar.google.com/scholar?q=related:tDXJgKnIr6MJ:scholar.google.com/&scioq=source:%22journal+of+personality+and+social+psychology%22&hl=en&as_sdt=0,5&as_ylo=2020&as_yhi=2020"
"453",32,"EC Willroth, OP John, JC Biesanz…","Understanding short-term variability in life satisfaction: The Individual Differences in Evaluating Life Satisfaction (IDELS) model.",2020,"… of personality and social …","psycnet.apa.org","https://psycnet.apa.org/record/2019-51312-001","https://scholar.google.com/scholar?cites=13966450453674235492&as_sdt=2005&sciodt=0,5&hl=en",79,2023-08-22 17:17:06,NA,NA,NA,NA,NA,NA,NA,NA,32,10.67,8,4,3,"Daily life is full of emotional ups and downs. In contrast, the objective conditions of our lives usually remain relatively stable from day to day. The degree to which emotional ups and …","https://psycnet.apa.org/manuscript/2019-51312-001.pdf","https://scholar.google.com/scholar?q=related:ZJZYsLDM0sEJ:scholar.google.com/&scioq=source:%22journal+of+personality+and+social+psychology%22&hl=en&as_sdt=0,5&as_ylo=2020&as_yhi=2020"
"454",39,"JR Oltmanns, JJ Jackson…","Personality change: Longitudinal self-other agreement and convergence with retrospective-reports.",2020,"Journal of Personality and …","psycnet.apa.org","https://psycnet.apa.org/record/2019-11840-001","https://scholar.google.com/scholar?cites=2909805855761904663&as_sdt=2005&sciodt=0,5&hl=en",80,2023-08-22 17:17:06,NA,NA,NA,NA,NA,NA,NA,NA,39,13,13,3,3,"The research literature on personality development is based mostly on self-report studies and on samples in younger adulthood. The present multimethod study examines self-other …","https://psycnet.apa.org/manuscript/2019-11840-001.pdf","https://scholar.google.com/scholar?q=related:FzQKTgK1YSgJ:scholar.google.com/&scioq=source:%22journal+of+personality+and+social+psychology%22&hl=en&as_sdt=0,5&as_ylo=2020&as_yhi=2020"
"455",27,"NW Hudson, RE Lucas…","Are we happier with others? An investigation of the links between spending time with others and subjective well-being.",2020,"Journal of personality and …","psycnet.apa.org","https://psycnet.apa.org/record/2020-20116-001","https://scholar.google.com/scholar?cites=15133119381212046237&as_sdt=2005&sciodt=0,5&hl=en",81,2023-08-22 17:17:06,NA,NA,NA,NA,NA,NA,NA,NA,27,9,9,3,3,"Previous research suggests that having close relationships is a fundamental human need that, when fulfilled, is positively associated with subjective well-being. Recently, however …","https://psycnet.apa.org/manuscript/2020-20116-001.pdf","https://scholar.google.com/scholar?q=related:nSO5BOajA9IJ:scholar.google.com/&scioq=source:%22journal+of+personality+and+social+psychology%22&hl=en&as_sdt=0,5&as_ylo=2020&as_yhi=2020"
"456",35,"DE Forster, J Billingsley, VM Russell…","Forgiveness takes place on an attitudinal continuum from hostility to friendliness: Toward a closer union of forgiveness theory and measurement.",2020,"… personality and social …","psycnet.apa.org","https://psycnet.apa.org/record/2019-75475-001","https://scholar.google.com/scholar?cites=8355845600779439795&as_sdt=2005&sciodt=0,5&hl=en",82,2023-08-22 17:17:06,NA,NA,NA,NA,NA,NA,NA,NA,35,11.67,9,4,3,"Researchers commonly conceptualize forgiveness as a rich complex of psychological changes involving attitudes, emotions, and behaviors. Psychometric work with the measures …","https://escholarship.org/content/qt0d56718f/qt0d56718f.pdf","https://scholar.google.com/scholar?q=related:sw54gE3t9XMJ:scholar.google.com/&scioq=source:%22journal+of+personality+and+social+psychology%22&hl=en&as_sdt=0,5&as_ylo=2020&as_yhi=2020"
"457",27,"BK Jakubiak, BC Feeney, RA Ferrer","Benefits of daily support visibility versus invisibility across the adult life span.",2020,"Journal of personality and …","psycnet.apa.org","https://psycnet.apa.org/record/2019-43750-001","https://scholar.google.com/scholar?cites=3349595907684453358&as_sdt=2005&sciodt=0,5&hl=en",83,2023-08-22 17:17:06,NA,NA,NA,NA,NA,NA,NA,NA,27,9,9,3,3,"Amid growing disagreement about the benefits of visible and invisible support, we tested daily associations among support visibility and changes in individual and relational well …","https://psycnet.apa.org/manuscript/2019-43750-001.pdf","https://scholar.google.com/scholar?q=related:7kuiKrsnfC4J:scholar.google.com/&scioq=source:%22journal+of+personality+and+social+psychology%22&hl=en&as_sdt=0,5&as_ylo=2020&as_yhi=2020"
"458",28,"JM Majer, R Trötschel, AD Galinsky…","Open to offers, but resisting requests: How the framing of anchors affects motivation and negotiated outcomes.",2020,"… and social psychology","psycnet.apa.org","https://psycnet.apa.org/record/2019-57561-001","https://scholar.google.com/scholar?cites=8834039795070867136&as_sdt=2005&sciodt=0,5&hl=en",84,2023-08-22 17:17:06,NA,NA,NA,NA,NA,NA,NA,NA,28,9.33,7,4,3,"Abundant research has established that first proposals can anchor negotiations and lead to a first-mover advantage. The current research developed and tested a motivated anchor …",NA,"https://scholar.google.com/scholar?q=related:wBbdjGPQmHoJ:scholar.google.com/&scioq=source:%22journal+of+personality+and+social+psychology%22&hl=en&as_sdt=0,5&as_ylo=2020&as_yhi=2020"
"459",27,"JJ Zlatev, DM Kupor, K Laurin…","Being “good” or “good enough”: Prosocial risk and the structure of moral self-regard.",2020,"Journal of personality and …","psycnet.apa.org","https://psycnet.apa.org/record/2019-67039-001","https://scholar.google.com/scholar?cites=5833797424468738537&as_sdt=2005&sciodt=0,5&hl=en",85,2023-08-22 17:17:06,NA,NA,NA,NA,NA,NA,NA,NA,27,9,7,4,3,"The motivation to feel moral powerfully guides people's prosocial behavior. We propose that people's efforts to preserve their moral self-regard conform to a moral threshold model. This …",NA,"https://scholar.google.com/scholar?q=related:6UEMSdnP9VAJ:scholar.google.com/&scioq=source:%22journal+of+personality+and+social+psychology%22&hl=en&as_sdt=0,5&as_ylo=2020&as_yhi=2020"
"460",26,"LE Wallace, DT Wegener, RE Petty","Influences of source bias that differ from source untrustworthiness: When flip-flopping is more and less surprising.",2020,"Journal of personality and …","psycnet.apa.org","https://psycnet.apa.org/record/2019-68484-001","https://scholar.google.com/scholar?cites=11000249509593654543&as_sdt=2005&sciodt=0,5&hl=en",86,2023-08-22 17:17:06,NA,NA,NA,NA,NA,NA,NA,NA,26,8.67,9,3,3,"Discussions of the difference between biased and fake news were prevalent after the 2016 United States Presidential election. However, within social psychology, and especially the …","https://psycnet.apa.org/manuscript/2019-68484-001.pdf","https://scholar.google.com/scholar?q=related:D6X-q6W8qJgJ:scholar.google.com/&scioq=source:%22journal+of+personality+and+social+psychology%22&hl=en&as_sdt=0,5&as_ylo=2020&as_yhi=2020"
