"","Cites","Authors","Title","Year","Source","Publisher","ArticleURL","CitesURL","GSRank","QueryDate","Type","DOI","ISSN","CitationURL","Volume","Issue","StartPage","EndPage","ECC","CitesPerYear","CitesPerAuthor","AuthorCount","Age","Abstract","FullTextURL","RelatedURL","year"
"395",37,"L Grigoryan, X Bai, F Durante…","Stereotypes as historical accidents: Images of social class in postcommunist versus capitalist societies",2020,"… Psychology Bulletin","journals.sagepub.com","https://journals.sagepub.com/doi/abs/10.1177/0146167219881434","https://scholar.google.com/scholar?cites=1873766259197067406&as_sdt=2005&sciodt=0,5&hl=en",22,2023-09-25 15:51:21,NA,"10.1177/0146167219881434",NA,NA,NA,NA,NA,NA,37,12.33,9,4,3,"Stereotypes are ideological and justify the existing social structure. Although stereotypes persist, they can change when the context changes. Communism's rise in Eastern Europe …",NA,"https://scholar.google.com/scholar?q=related:jsCNL3z0ABoJ:scholar.google.com/&scioq=source:%22personality+and+social+psychology+bulletin%22&hl=en&as_sdt=0,5&as_ylo=2020&as_yhi=2020",2020
"396",40,"A Vishkin, Y Hasson, Y Millgram…","One size does not fit all: Tailoring cognitive reappraisal to different emotions",2020,"… and Social Psychology …","journals.sagepub.com","https://journals.sagepub.com/doi/abs/10.1177/0146167219861432","https://scholar.google.com/scholar?cites=18282353155708106782&as_sdt=2005&sciodt=0,5&hl=en",23,2023-09-25 15:51:21,NA,"10.1177/0146167219861432",NA,NA,NA,NA,NA,NA,40,13.33,10,4,3,"Emotion regulation strategies have been typically studied independently of the specific emotions people try to change by using them. However, to the extent that negative emotions …","https://www.researchgate.net/profile/Allon-Vishkin/publication/334575844_One_Size_Does_Not_Fit_All_Tailoring_Cognitive_Reappraisal_to_Different_Emotions/links/5d36dd71299bf1995b42bbed/One-Size-Does-Not-Fit-All-Tailoring-Cognitive-Reappraisal-to-Different-Emotions.pdf","https://scholar.google.com/scholar?q=related:Hjg5wFT3t_0J:scholar.google.com/&scioq=source:%22personality+and+social+psychology+bulletin%22&hl=en&as_sdt=0,5&as_ylo=2020&as_yhi=2020",2020
"397",49,"AF Pagani, M Parise, S Donato…","If you shared my happiness, you are part of me: Capitalization and the experience of couple identity",2020,"… Psychology Bulletin","journals.sagepub.com","https://journals.sagepub.com/doi/abs/10.1177/0146167219854449","https://scholar.google.com/scholar?cites=14925758158541591882&as_sdt=2005&sciodt=0,5&hl=en",24,2023-09-25 15:51:21,NA,"10.1177/0146167219854449",NA,NA,NA,NA,NA,NA,49,16.33,12,4,3,"The way in which individuals react to a partner's disclosure of positive news (capitalization response) is associated with relational well-being. Two studies analyzed the role of couple …",NA,"https://scholar.google.com/scholar?q=related:SpVCE_fxIs8J:scholar.google.com/&scioq=source:%22personality+and+social+psychology+bulletin%22&hl=en&as_sdt=0,5&as_ylo=2020&as_yhi=2020",2020
"398",35,"LZ Williamson, BM Wilkowski","Nipping temptation in the bud: Examining strategic self-control in daily life",2020,"… social psychology bulletin","journals.sagepub.com","https://journals.sagepub.com/doi/abs/10.1177/0146167219883606","https://scholar.google.com/scholar?cites=5163042628844305483&as_sdt=2005&sciodt=0,5&hl=en",25,2023-09-25 15:51:21,NA,"10.1177/0146167219883606",NA,NA,NA,NA,NA,NA,35,11.67,18,2,3,"Self-control is often thought to be reactive and focused solely on the inhibition of responses elicited by temptations. In two studies, we assessed whether self-control can instead (a) be …","http://www.uwyo.edu/psychology/_files/docs/ben-wilkowski-docs/proactiveself-control-pspb-accepted.pdf","https://scholar.google.com/scholar?q=related:S7x2fOrPpkcJ:scholar.google.com/&scioq=source:%22personality+and+social+psychology+bulletin%22&hl=en&as_sdt=0,5&as_ylo=2020&as_yhi=2020",2020
"399",37,"CC Banker, MR Leary","Hypo-egoic nonentitlement as a feature of humility",2020,"Personality and Social Psychology …","journals.sagepub.com","https://journals.sagepub.com/doi/abs/10.1177/0146167219875144","https://scholar.google.com/scholar?cites=13488372956599706596&as_sdt=2005&sciodt=0,5&hl=en",26,2023-09-25 15:51:21,NA,"10.1177/0146167219875144",NA,NA,NA,NA,NA,NA,37,12.33,19,2,3,"Two studies tested the hypothesis that humility is characterized by the belief that, no matter how extraordinary one's accomplishments or characteristics may be, one is not entitled to be …",NA,"https://scholar.google.com/scholar?q=related:5GMcVL1TMLsJ:scholar.google.com/&scioq=source:%22personality+and+social+psychology+bulletin%22&hl=en&as_sdt=0,5&as_ylo=2020&as_yhi=2020",2020
"400",50,"JLT Leong, SX Chen, HHL Fung…","Is gratitude always beneficial to interpersonal relationships? The interplay of grateful disposition, grateful mood, and grateful expression among married couples",2020,"… Psychology Bulletin","journals.sagepub.com","https://journals.sagepub.com/doi/abs/10.1177/0146167219842868","https://scholar.google.com/scholar?cites=11690558152162831733&as_sdt=2005&sciodt=0,5&hl=en",27,2023-09-25 15:51:21,NA,"10.1177/0146167219842868",NA,NA,NA,NA,NA,NA,50,16.67,13,4,3,"A growing body of research has documented positive outcomes of gratitude in personal and interpersonal domains. To uncover the dynamic process of gratitude and relational well …","https://journals.sagepub.com/doi/pdf/10.1177/0146167219842868","https://scholar.google.com/scholar?q=related:dW22PbM0PaIJ:scholar.google.com/&scioq=source:%22personality+and+social+psychology+bulletin%22&hl=en&as_sdt=0,5&as_ylo=2020&as_yhi=2020",2020
"401",34,"MS Allen, DA Robson, LJ Martin…","Systematic review and meta-analysis of self-serving attribution biases in the competitive context of organized sport",2020,"… and Social Psychology …","journals.sagepub.com","https://journals.sagepub.com/doi/abs/10.1177/0146167219893995","https://scholar.google.com/scholar?cites=301752051579651074&as_sdt=2005&sciodt=0,5&hl=en",28,2023-09-25 15:51:21,NA,"10.1177/0146167219893995",NA,NA,NA,NA,NA,NA,34,11.33,9,4,3,"This meta-analysis explored the magnitude of self-serving attribution biases for real-world athletic outcomes. A comprehensive literature search identified 69 studies (160 effect sizes; …",NA,"https://scholar.google.com/scholar?q=related:AoSmZOQJMAQJ:scholar.google.com/&scioq=source:%22personality+and+social+psychology+bulletin%22&hl=en&as_sdt=0,5&as_ylo=2020&as_yhi=2020",2020
"402",54,"KA Valentine, NP Li, AL Meltzer…","Mate preferences for warmth-trustworthiness predict romantic attraction in the early stages of mate selection and satisfaction in ongoing relationships",2020,"… and Social Psychology …","journals.sagepub.com","https://journals.sagepub.com/doi/abs/10.1177/0146167219855048","https://scholar.google.com/scholar?cites=11915075045069099179&as_sdt=2005&sciodt=0,5&hl=en",29,2023-09-25 15:51:21,NA,"10.1177/0146167219855048",NA,NA,NA,NA,NA,NA,54,18,14,4,3,"People seek warm and trustworthy individuals as long-term mates for numerous reasons. Indeed, such individuals are prone to cooperation, have strong parenting skills, have the …","https://ink.library.smu.edu.sg/cgi/viewcontent.cgi?article=4147&context=soss_research","https://scholar.google.com/scholar?q=related:qxB37Z_ZWqUJ:scholar.google.com/&scioq=source:%22personality+and+social+psychology+bulletin%22&hl=en&as_sdt=0,5&as_ylo=2020&as_yhi=2020",2020
"403",34,"B Major, JA Rathbone, A Blodorn…","The countervailing effects of weight stigma on weight-loss motivation and perceived capacity for weight control",2020,"… and Social Psychology …","journals.sagepub.com","https://journals.sagepub.com/doi/abs/10.1177/0146167220903184","https://scholar.google.com/scholar?cites=8655101087325404795&as_sdt=2005&sciodt=0,5&hl=en",30,2023-09-25 15:51:21,NA,"10.1177/0146167220903184",NA,NA,NA,NA,NA,NA,34,11.33,9,4,3,"We hypothesized that exposure to weight stigma simultaneously increases motivation to lose or avoid gaining weight to avoid future stigma and decreases perceived capacity to do …","https://www.jeffreyhunger.com/uploads/3/4/4/8/34481134/major_rathbone_blodorn___hunger__2020__-_pspb.pdf","https://scholar.google.com/scholar?q=related:e74gDZUYHXgJ:scholar.google.com/&scioq=source:%22personality+and+social+psychology+bulletin%22&hl=en&as_sdt=0,5&as_ylo=2020&as_yhi=2020",2020
"404",34,"R Covarrubias, I Landa…","Developing a family achievement guilt scale grounded in first-generation college student voices",2020,"… and Social Psychology …","journals.sagepub.com","https://journals.sagepub.com/doi/abs/10.1177/0146167220908382","https://scholar.google.com/scholar?cites=15342770980027602644&as_sdt=2005&sciodt=0,5&hl=en",31,2023-09-25 15:51:21,NA,"10.1177/0146167220908382",NA,NA,NA,NA,NA,NA,34,11.33,11,3,3,"As the first in their families to attend college, first-generation students plausibly experience family achievement guilt—socioemotional distress related to “leaving family members” to …","https://www.researchgate.net/profile/Ronald-Gallimore/publication/339937434_Developing_a_Family_Achievement_Guilt_Scale_Grounded_in_First-Generation_College_Student_Voices/links/5e7525a1299bf1892cfbca2a/Developing-a-Family-Achievement-Guilt-Scale-Grounded-in-First-Generation-College-Student-Voices.pdf","https://scholar.google.com/scholar?q=related:1Ja3tup47NQJ:scholar.google.com/&scioq=source:%22personality+and+social+psychology+bulletin%22&hl=en&as_sdt=0,5&as_ylo=2020&as_yhi=2020",2020
"405",43,"S Yu, SL Blader","Why does social class affect subjective well-being? The role of status and power",2020,"Personality and Social Psychology Bulletin","journals.sagepub.com","https://journals.sagepub.com/doi/abs/10.1177/0146167219853841","https://scholar.google.com/scholar?cites=8994822876395761738&as_sdt=2005&sciodt=0,5&hl=en",32,2023-09-25 15:51:21,NA,"10.1177/0146167219853841",NA,NA,NA,NA,NA,NA,43,14.33,22,2,3,"The link between social class and subjective well-being (SWB) has been an important topic of inquiry, with broad implications for understanding the psychology of social class and the …","https://www.researchgate.net/profile/Siyu-Yu-3/publication/333800141_Why_Does_Social_Class_Affect_Subjective_Well-Being_The_Role_of_Status_and_Power/links/5d06531e299bf12e7be49dd1/Why-Does-Social-Class-Affect-Subjective-Well-Being-The-Role-of-Status-and-Power.pdf","https://scholar.google.com/scholar?q=related:SnAg3b8H1HwJ:scholar.google.com/&scioq=source:%22personality+and+social+psychology+bulletin%22&hl=en&as_sdt=0,5&as_ylo=2020&as_yhi=2020",2020
"406",32,"M Kroneisen, DW Heck","Interindividual differences in the sensitivity for consequences, moral norms, and preferences for inaction: Relating basic personality traits to the CNI model",2020,"Personality and Social Psychology …","journals.sagepub.com","https://journals.sagepub.com/doi/abs/10.1177/0146167219893994","https://scholar.google.com/scholar?cites=8742171583781890074&as_sdt=2005&sciodt=0,5&hl=en",33,2023-09-25 15:51:21,NA,"10.1177/0146167219893994",NA,NA,NA,NA,NA,NA,32,10.67,16,2,3,"Research on moral decision making usually focuses on two ethical principles: the principle of utilitarianism (= morality of an action is determined by its consequences) and the principle …","https://journals.sagepub.com/doi/pdf/10.1177/0146167219893994","https://scholar.google.com/scholar?q=related:GmjVyLxuUnkJ:scholar.google.com/&scioq=source:%22personality+and+social+psychology+bulletin%22&hl=en&as_sdt=0,5&as_ylo=2020&as_yhi=2020",2020
"407",41,"L Hamley, CA Houkamau, D Osborne…","Ingroup love or outgroup hate (or both)? Mapping distinct bias profiles in the population",2020,"… Psychology Bulletin","journals.sagepub.com","https://journals.sagepub.com/doi/abs/10.1177/0146167219845919","https://scholar.google.com/scholar?cites=17543262627760630179&as_sdt=2005&sciodt=0,5&hl=en",34,2023-09-25 15:51:21,NA,"10.1177/0146167219845919",NA,NA,NA,NA,NA,NA,41,13.67,10,4,3,"Researchers have long argued that ingroup favoritism and outgroup derogation are separable phenomena that occur in different, meaningful combinations. Statistical methods …",NA,"https://scholar.google.com/scholar?q=related:o-kOaWkwdvMJ:scholar.google.com/&scioq=source:%22personality+and+social+psychology+bulletin%22&hl=en&as_sdt=0,5&as_ylo=2020&as_yhi=2020",2020
"408",34,"LA Rudman, LH Saud","Justifying social inequalities: The role of social Darwinism",2020,"Personality and Social Psychology …","journals.sagepub.com","https://journals.sagepub.com/doi/abs/10.1177/0146167219896924","https://scholar.google.com/scholar?cites=14546427855973029411&as_sdt=2005&sciodt=0,5&hl=en",35,2023-09-25 15:51:21,NA,"10.1177/0146167219896924",NA,NA,NA,NA,NA,NA,34,11.33,17,2,3,"Three studies supported a model whereby associations between ideologies that share roots in biological determinism and outcomes that reinforce inequality (based on gender, race, or …","https://www.researchgate.net/profile/Laurie-Rudman/publication/338412984_Justifying_Social_Inequalities_The_Role_of_Social_Darwinism/links/5ee1196c92851c31f3c78bb2/Justifying-Social-Inequalities-The-Role-of-Social-Darwinism.pdf","https://scholar.google.com/scholar?q=related:I5YekhBL38kJ:scholar.google.com/&scioq=source:%22personality+and+social+psychology+bulletin%22&hl=en&as_sdt=0,5&as_ylo=2020&as_yhi=2020",2020
"409",32,"L Murphy, E Cadogan…","The consideration of future consequences: Evidence for domain specificity across five life domains",2020,"… Social Psychology Bulletin","journals.sagepub.com","https://journals.sagepub.com/doi/abs/10.1177/0146167219873478","https://scholar.google.com/scholar?cites=9482455959070154626&as_sdt=2005&sciodt=0,5&hl=en",36,2023-09-25 15:51:21,NA,"10.1177/0146167219873478",NA,NA,NA,NA,NA,NA,32,10.67,11,3,3,"The consideration of future consequences (CFC) is a cognitive-motivational construct describing the extent to which individuals consider the future outcomes of behavior during …",NA,"https://scholar.google.com/scholar?q=related:gp-pXnRzmIMJ:scholar.google.com/&scioq=source:%22personality+and+social+psychology+bulletin%22&hl=en&as_sdt=0,5&as_ylo=2020&as_yhi=2020",2020
"410",32,"EP Lloyd, M Sim, E Smalley…","Good cop, bad cop: Race-based differences in mental representations of police",2020,"… Psychology Bulletin","journals.sagepub.com","https://journals.sagepub.com/doi/abs/10.1177/0146167219898562","https://scholar.google.com/scholar?cites=9504046216176459639&as_sdt=2005&sciodt=0,5&hl=en",37,2023-09-25 15:51:21,NA,"10.1177/0146167219898562",NA,NA,NA,NA,NA,NA,32,10.67,8,4,3,"The current work investigates race-based biases in conceptualization of the facial appearance of police. We employ a reverse correlation procedure to demonstrate that Black …","https://journals.sagepub.com/doi/pdf/10.1177/0146167219898562","https://scholar.google.com/scholar?q=related:d98X1K0n5YMJ:scholar.google.com/&scioq=source:%22personality+and+social+psychology+bulletin%22&hl=en&as_sdt=0,5&as_ylo=2020&as_yhi=2020",2020
"411",30,"A Vishkin, SH Schwartz…","Religiosity and desired emotions: Belief maintenance or prosocial facilitation?",2020,"… Psychology Bulletin","journals.sagepub.com","https://journals.sagepub.com/doi/abs/10.1177/0146167219895140","https://scholar.google.com/scholar?cites=13338594198067596112&as_sdt=2005&sciodt=0,5&hl=en",38,2023-09-25 15:51:21,NA,"10.1177/0146167219895140",NA,NA,NA,NA,NA,NA,30,10,10,3,3,"We assessed how religiosity is related to desired emotions. We tested two competing hypotheses. First, religiosity could be associated with a stronger desire for emotions that …","https://www.researchgate.net/profile/Shalom-Schwartz/publication/338429474_Religiosity_and_Desired_Emotions_Belief_Maintenance_or_Prosocial_Facilitation/links/5e3b1fcb299bf1cdb911345c/Religiosity-and-Desired-Emotions-Belief-Maintenance-or-Prosocial-Facilitation.pdf","https://scholar.google.com/scholar?q=related:UMvnksA0HLkJ:scholar.google.com/&scioq=source:%22personality+and+social+psychology+bulletin%22&hl=en&as_sdt=0,5&as_ylo=2020&as_yhi=2020",2020
"412",29,"ER Smith, S Sherrin, MR Fraune…","Positive emotions, more than anxiety or other negative emotions, predict willingness to interact with robots",2020,"… Psychology Bulletin","journals.sagepub.com","https://journals.sagepub.com/doi/abs/10.1177/0146167219900439","https://scholar.google.com/scholar?cites=10203229709544964071&as_sdt=2005&sciodt=0,5&hl=en",39,2023-09-25 15:51:21,NA,"10.1177/0146167219900439",NA,NA,NA,NA,NA,NA,29,9.67,7,4,3,"Like early work on human intergroup interaction, previous research on people's willingness to interact with robots has focused mainly on effects of anxiety. However, existing findings …","https://journals.sagepub.com/doi/pdf/10.1177/0146167219900439","https://scholar.google.com/scholar?q=related:578jn1wnmY0J:scholar.google.com/&scioq=source:%22personality+and+social+psychology+bulletin%22&hl=en&as_sdt=0,5&as_ylo=2020&as_yhi=2020",2020
"413",33,"AK Teunisse, TI Case, J Fitness…","I should have known better: Development of a self-report measure of gullibility",2020,"… and Social Psychology …","journals.sagepub.com","https://journals.sagepub.com/doi/abs/10.1177/0146167219858641","https://scholar.google.com/scholar?cites=7995322828328413656&as_sdt=2005&sciodt=0,5&hl=en",40,2023-09-25 15:51:21,NA,"10.1177/0146167219858641",NA,NA,NA,NA,NA,NA,33,11,8,4,3,"The aim of this research was to explore the predictors of gullibility and to develop a self-report measure of the construct. In Studies 1 to 3, exploratory and confirmatory factor …",NA,"https://scholar.google.com/scholar?q=related:2CkWV8AX9W4J:scholar.google.com/&scioq=source:%22personality+and+social+psychology+bulletin%22&hl=en&as_sdt=0,5&as_ylo=2020&as_yhi=2020",2020
"414",29,"L Macchia, AC Plagnol…","Buying happiness in an unequal world: Rank of income more strongly predicts well-being in more unequal countries",2020,"… and Social Psychology …","journals.sagepub.com","https://journals.sagepub.com/doi/abs/10.1177/0146167219877413","https://scholar.google.com/scholar?cites=13692586578095759635&as_sdt=2005&sciodt=0,5&hl=en",41,2023-09-25 15:51:21,NA,"10.1177/0146167219877413",NA,NA,NA,NA,NA,NA,29,9.67,10,3,3,"Does income rank matter more for well-being in more unequal countries? Using more than 160,000 observations from 24 countries worldwide, we replicate previous studies and show …","https://wrap.warwick.ac.uk/124206/1/WRAP-buying-happiness-unequal-world-Powdthavee-2019.pdf","https://scholar.google.com/scholar?q=related:E-GtQ_LWBb4J:scholar.google.com/&scioq=source:%22personality+and+social+psychology+bulletin%22&hl=en&as_sdt=0,5&as_ylo=2020&as_yhi=2020",2020
"415",30,"AM Gordon, AA Prather, T Dover…","Anticipated and experienced ethnic/racial discrimination and sleep: a longitudinal study",2020,"… Psychology Bulletin","journals.sagepub.com","https://journals.sagepub.com/doi/abs/10.1177/0146167220928859","https://scholar.google.com/scholar?cites=6629615166241958032&as_sdt=2005&sciodt=0,5&hl=en",42,2023-09-25 15:51:21,NA,"10.1177/0146167220928859",NA,NA,NA,NA,NA,NA,30,10,8,4,3,"The transition to college is a stressful experience. For members of underrepresented minority groups, the usual stresses are frequently accompanied by ethnicity-based stressors …","https://sites.lsa.umich.edu/whirl/wp-content/uploads/sites/792/2020/08/Gordon-et-al-2020-PSPB.pdf","https://scholar.google.com/scholar?q=related:kOhkVd4fAVwJ:scholar.google.com/&scioq=source:%22personality+and+social+psychology+bulletin%22&hl=en&as_sdt=0,5&as_ylo=2020&as_yhi=2020",2020
"416",26,"AH Cairo, JD Green, DR Forsyth…","Gray (literature) matters: Evidence of selective hypothesis reporting in social psychological research",2020,"… Psychology Bulletin","journals.sagepub.com","https://journals.sagepub.com/doi/abs/10.1177/0146167220903896","https://scholar.google.com/scholar?cites=10135568211669775437&as_sdt=2005&sciodt=0,5&hl=en",43,2023-09-25 15:51:21,NA,"10.1177/0146167220903896",NA,NA,NA,NA,NA,NA,26,8.67,7,4,3,"Selective reporting practices (SRPs)—adding, dropping, or altering study elements when preparing reports for publication—are thought to increase false positives in scientific …","https://www.researchgate.net/profile/Jeffrey-Green-5/publication/339482653_Gray_Literature_Matters_Evidence_of_Selective_Hypothesis_Reporting_in_Social_Psychological_Research/links/5ee6479e458515814a5e7d39/Gray-Literature-Matters-Evidence-of-Selective-Hypothesis-Reporting-in-Social-Psychological-Research.pdf","https://scholar.google.com/scholar?q=related:TXRRhZbFqIwJ:scholar.google.com/&scioq=source:%22personality+and+social+psychology+bulletin%22&hl=en&as_sdt=0,5&as_ylo=2020&as_yhi=2020",2020
"417",28,"NW Hudson, RE Lucas…","The highs and lows of love: Romantic relationship quality moderates whether spending time with one's partner predicts gains or losses in well-being",2020,"… and social psychology …","journals.sagepub.com","https://journals.sagepub.com/doi/abs/10.1177/0146167219867960","https://scholar.google.com/scholar?cites=8342276289579794241&as_sdt=2005&sciodt=0,5&hl=en",44,2023-09-25 15:51:21,NA,"10.1177/0146167219867960",NA,NA,NA,NA,NA,NA,28,9.33,9,3,3,"Previous research suggests both relationship status and relationship quality correlate with well-being. The present study extended these findings in three ways. First, we benchmarked …","https://www.nathanwhudson.com/vita/pdf/Hudson%20et%20al.,%202020c.pdf","https://scholar.google.com/scholar?q=related:QT-RCha4xXMJ:scholar.google.com/&scioq=source:%22personality+and+social+psychology+bulletin%22&hl=en&as_sdt=0,5&as_ylo=2020&as_yhi=2020",2020
"418",19,"C Anderson, JAD Hildreth…","The possession of high status strengthens the status motive",2020,"… and Social Psychology …","journals.sagepub.com","https://journals.sagepub.com/doi/abs/10.1177/0146167220937544","https://scholar.google.com/scholar?cites=14190474521456442366&as_sdt=2005&sciodt=0,5&hl=en",45,2023-09-25 15:51:21,NA,"10.1177/0146167220937544",NA,NA,NA,NA,NA,NA,19,6.33,6,3,3,"The current research tested whether the possession of high status, compared with the possession of low status, makes individuals desire having high status even more. Five …","https://www.researchgate.net/profile/Daron-Sharps/publication/342931109_The_Possession_of_High_Status_Strengthens_the_Status_Motive/links/60f342a30859317dbdedc950/The-Possession-of-High-Status-Strengthens-the-Status-Motive.pdf","https://scholar.google.com/scholar?q=related:_nuklWSx7sQJ:scholar.google.com/&scioq=source:%22personality+and+social+psychology+bulletin%22&hl=en&as_sdt=0,5&as_ylo=2020&as_yhi=2020",2020
"419",26,"SA Krol, R Thériault, JA Olson…","Self-concept clarity and the bodily self: Malleability across modalities",2020,"… Psychology Bulletin","journals.sagepub.com","https://journals.sagepub.com/doi/abs/10.1177/0146167219879126","https://scholar.google.com/scholar?cites=16712149535213865511&as_sdt=2005&sciodt=0,5&hl=en",46,2023-09-25 15:51:21,NA,"10.1177/0146167219879126",NA,NA,NA,NA,NA,NA,26,8.67,7,4,3,"The self has fascinated scholars for centuries. Although theory suggests that the self-concept (cognitive self-understanding) and bodily self (pre-reflective awareness of one's body) are …","https://digitalcommons.chapman.edu/cgi/viewcontent.cgi?article=1191&context=psychology_articles","https://scholar.google.com/scholar?q=related:J8qhH3V77ecJ:scholar.google.com/&scioq=source:%22personality+and+social+psychology+bulletin%22&hl=en&as_sdt=0,5&as_ylo=2020&as_yhi=2020",2020
"420",27,"AMC Behler, CSJ Wall, A Bos…","To help or to harm? Assessing the impact of envy on prosocial and antisocial behaviors",2020,"… and Social Psychology …","journals.sagepub.com","https://journals.sagepub.com/doi/abs/10.1177/0146167219897660","https://scholar.google.com/scholar?cites=291633139719971015&as_sdt=2005&sciodt=0,5&hl=en",47,2023-09-25 15:51:21,NA,"10.1177/0146167219897660",NA,NA,NA,NA,NA,NA,27,9,7,4,3,"Two studies examined how envy influences prosocial and antisocial behavior. In Experiment 1, participants in an envious state (relative to a neutral state) were less helpful: They picked …","https://www.researchgate.net/profile/Anna-Maria-Behler/publication/338553689_To_Help_or_To_Harm_Assessing_the_Impact_of_Envy_on_Prosocial_and_Antisocial_Behaviors/links/5e38ca5b299bf1cdb90aef08/To-Help-or-To-Harm-Assessing-the-Impact-of-Envy-on-Prosocial-and-Antisocial-Behaviors.pdf","https://scholar.google.com/scholar?q=related:x6C9ocsWDAQJ:scholar.google.com/&scioq=source:%22personality+and+social+psychology+bulletin%22&hl=en&as_sdt=0,5&as_ylo=2020&as_yhi=2020",2020
"421",32,"KRG White, D Kinney, RH Danek…","The Resistance to Change-Beliefs Scale: Validation of a new measure of conservative ideology",2020,"… Psychology Bulletin","journals.sagepub.com","https://journals.sagepub.com/doi/abs/10.1177/0146167219841624","https://scholar.google.com/scholar?cites=10792655942771449799&as_sdt=2005&sciodt=0,5&hl=en",48,2023-09-25 15:51:21,NA,"10.1177/0146167219841624",NA,NA,NA,NA,NA,NA,32,10.67,8,4,3,"The motivated social cognition (MSC) model of conservative ideology posits there are two core facets of conservative political ideology—endorsement of hierarchies and resistance to …","https://journals.sagepub.com/doi/pdf/10.1177/0146167219841624","https://scholar.google.com/scholar?q=related:x5_m42U3x5UJ:scholar.google.com/&scioq=source:%22personality+and+social+psychology+bulletin%22&hl=en&as_sdt=0,5&as_ylo=2020&as_yhi=2020",2020
