"","Cites","Authors","Title","Year","Source","Publisher","ArticleURL","CitesURL","GSRank","QueryDate","Type","DOI","ISSN","CitationURL","Volume","Issue","StartPage","EndPage","ECC","CitesPerYear","CitesPerAuthor","AuthorCount","Age","Abstract","FullTextURL","RelatedURL","year"
"1",406,"MR Leary, KJ Diebels, EK Davisson, ...","Cognitive and interpersonal features of intellectual humility",2017,"… Psychology Bulletin","journals.sagepub.com","https://journals.sagepub.com/doi/abs/10.1177/0146167217697695","https://scholar.google.com/scholar?cites=838340928712214908&as_sdt=2005&sciodt=0,5&hl=en",1,2023-09-25 13:27:02,NA,"10.1177/0146167217697695",NA,NA,NA,NA,NA,NA,406,67.67,102,4,6,"Four studies examined intellectual humility—the degree to which people recognize that their beliefs might be wrong. Using a new Intellectual Humility (IH) Scale, Study 1 showed that …","https://dukespace.lib.duke.edu/dspace/bitstream/handle/10161/23967/Intellectual%20Humility%202017.pdf?sequence=2","https://scholar.google.com/scholar?q=related:fAmQCKJiogsJ:scholar.google.com/&scioq=source:%22personality+and+social+psychology+bulletin%22&hl=en&as_sdt=0,5&as_ylo=2017&as_yhi=2017",2017
"2",292,"KM Sheldon, EN Osin, TO Gordeeva, ...","Evaluating the dimensionality of self-determination theory's relative autonomy continuum",2017,"… Psychology Bulletin","journals.sagepub.com","https://journals.sagepub.com/doi/abs/10.1177/0146167217711915","https://scholar.google.com/scholar?cites=16080911052987205906&as_sdt=2005&sciodt=0,5&hl=en",2,2023-09-25 13:27:02,NA,"10.1177/0146167217711915",NA,NA,NA,NA,NA,NA,292,48.67,73,4,6,"We conducted a theoretical and psychometric evaluation of self-determination theory's “relative autonomy continuum”(RAC), an important aspect of the theory whose validity has …","https://publications.hse.ru/pubs/share/folder/fq1fa6hki5/168816083.pdf","https://scholar.google.com/scholar?q=related:Eon0AWffKt8J:scholar.google.com/&scioq=source:%22personality+and+social+psychology+bulletin%22&hl=en&as_sdt=0,5&as_ylo=2017&as_yhi=2017",2017
"3",254,"N Kteily, E Bruneau","Backlash: The politics and real-world consequences of minority group dehumanization",2017,"Personality and Social Psychology …","journals.sagepub.com","https://journals.sagepub.com/doi/abs/10.1177/0146167216675334","https://scholar.google.com/scholar?cites=2426153995680242609&as_sdt=2005&sciodt=0,5&hl=en",3,2023-09-25 13:27:02,NA,"10.1177/0146167216675334",NA,NA,NA,NA,NA,NA,254,42.33,127,2,6,"Research suggests that members of advantaged groups who feel dehumanized by other groups respond aggressively. But little is known about how meta-dehumanization affects …","http://www.craiganderson.org/wp-content/uploads/caa/Classes/Readings/17Kteily-TrumpDehumanization.pdf","https://scholar.google.com/scholar?q=related:sVvqajRuqyEJ:scholar.google.com/&scioq=source:%22personality+and+social+psychology+bulletin%22&hl=en&as_sdt=0,5&as_ylo=2017&as_yhi=2017",2017
"4",253,"B Gawronski, M Morrison, CE Phills, ...","Temporal stability of implicit and explicit measures: A longitudinal analysis",2017,"… and Social Psychology …","journals.sagepub.com","https://journals.sagepub.com/doi/abs/10.1177/0146167216684131","https://scholar.google.com/scholar?cites=16305730842908975629&as_sdt=2005&sciodt=0,5&hl=en",4,2023-09-25 13:27:02,NA,"10.1177/0146167216684131",NA,NA,NA,NA,NA,NA,253,42.17,63,4,6,"A common assumption about implicit measures is that they reflect early experiences, whereas explicit measures are assumed to reflect recent experiences. This assumption …","http://www.bertramgawronski.com/documents/GMPG2017PSPB.pdf","https://scholar.google.com/scholar?q=related:DWK4Zs-XSeIJ:scholar.google.com/&scioq=source:%22personality+and+social+psychology+bulletin%22&hl=en&as_sdt=0,5&as_ylo=2017&as_yhi=2017",2017
"5",251,"NK Reimer, JC Becker, A Benz, ...","Intergroup contact and social change: Implications of negative and positive contact for collective action in advantaged and disadvantaged groups",2017,"… Psychology Bulletin","journals.sagepub.com","https://journals.sagepub.com/doi/abs/10.1177/0146167216676478","https://scholar.google.com/scholar?cites=17114699522853567743&as_sdt=2005&sciodt=0,5&hl=en",5,2023-09-25 13:27:02,NA,"10.1177/0146167216676478",NA,NA,NA,NA,NA,NA,251,41.83,63,4,6,"Previous research has shown that (a) positive intergroup contact with an advantaged group can discourage collective action among disadvantaged-group members and (b) positive …","https://orca.cardiff.ac.uk/id/eprint/102755/1/Rychlowska.%20Intergroup%20contact%20and%20social%20change%20%28002%29.pdf","https://scholar.google.com/scholar?q=related:__w72Ymgg-0J:scholar.google.com/&scioq=source:%22personality+and+social+psychology+bulletin%22&hl=en&as_sdt=0,5&as_ylo=2017&as_yhi=2017",2017
"6",202,"LE Hayward, LR Tropp, MJ Hornsey, ...","Toward a comprehensive understanding of intergroup contact: Descriptions and mediators of positive and negative contact among majority and minority groups",2017,"… Psychology Bulletin","journals.sagepub.com","https://journals.sagepub.com/doi/abs/10.1177/0146167216685291","https://scholar.google.com/scholar?cites=9806983325274021957&as_sdt=2005&sciodt=0,5&hl=en",6,2023-09-25 13:27:02,NA,"10.1177/0146167216685291",NA,NA,NA,NA,NA,NA,202,33.67,51,4,6,"Positive contact predicts reduced prejudice, but negative contact may increase prejudice at a stronger rate. The current project builds on this work in four ways: establishing an …","https://www.academia.edu/download/66510210/e39188ff4f4b1a7cbdf7c71c82e78ab4a924.pdf","https://scholar.google.com/scholar?q=related:RSAj7V9nGYgJ:scholar.google.com/&scioq=source:%22personality+and+social+psychology+bulletin%22&hl=en&as_sdt=0,5&as_ylo=2017&as_yhi=2017",2017
"7",193,"K Faniko, N Ellemers, B Derks, ...","Nothing changes, really: Why women who break through the glass ceiling end up reinforcing it",2017,"… Psychology Bulletin","journals.sagepub.com","https://journals.sagepub.com/doi/abs/10.1177/0146167217695551","https://scholar.google.com/scholar?cites=4311162818508849900&as_sdt=2005&sciodt=0,5&hl=en",7,2023-09-25 13:27:02,NA,"10.1177/0146167217695551",NA,NA,NA,NA,NA,NA,193,32.17,48,4,6,"Two correlational studies conducted in Switzerland (N= 222) and Albania (N= 156) explained the opposition of female managers to gender quotas by examining the origins and …","https://journals.sagepub.com/doi/full/10.1177/0146167217695551","https://scholar.google.com/scholar?q=related:7IIX7r1T1DsJ:scholar.google.com/&scioq=source:%22personality+and+social+psychology+bulletin%22&hl=en&as_sdt=0,5&as_ylo=2017&as_yhi=2017",2017
"8",161,"JA Krems, DT Kenrick, R Neel","Individual perceptions of self-actualization: What functional motives are linked to fulfilling one's full potential?",2017,"… Social Psychology Bulletin","journals.sagepub.com","https://journals.sagepub.com/doi/abs/10.1177/0146167217713191","https://scholar.google.com/scholar?cites=12134427175151259438&as_sdt=2005&sciodt=0,5&hl=en",8,2023-09-25 13:27:02,NA,"10.1177/0146167217713191",NA,NA,NA,NA,NA,NA,161,26.83,54,3,6,"Maslow's self-actualization remains a popular notion in academic research as well as popular culture. The notion that life's highest calling is fulfilling one's own unique potential …","https://www.academia.edu/download/76428498/krems_kenrick_neel_2017_pspb.pdf","https://scholar.google.com/scholar?q=related:Ls-8jzklZqgJ:scholar.google.com/&scioq=source:%22personality+and+social+psychology+bulletin%22&hl=en&as_sdt=0,5&as_ylo=2017&as_yhi=2017",2017
"9",137,"W Stroebe, NP Leander, ...","Is it a dangerous world out there? The motivational bases of American gun ownership",2017,"… and social psychology …","journals.sagepub.com","https://journals.sagepub.com/doi/abs/10.1177/0146167217703952","https://scholar.google.com/scholar?cites=7629182383306091857&as_sdt=2005&sciodt=0,5&hl=en",9,2023-09-25 13:27:02,NA,"10.1177/0146167217703952",NA,NA,NA,NA,NA,NA,137,22.83,46,3,6,"Americans are the world's best armed citizens and public polling suggests protection/self-defense is their main reason for gun ownership. However, there is virtually no psychological …","https://research.rug.nl/files/42736578/0146167217703952.pdf","https://scholar.google.com/scholar?q=related:Ua2g2_RM4GkJ:scholar.google.com/&scioq=source:%22personality+and+social+psychology+bulletin%22&hl=en&as_sdt=0,5&as_ylo=2017&as_yhi=2017",2017
"10",126,"CA Anderson, K Suzuki, EL Swing, ...","Media violence and other aggression risk factors in seven nations",2017,"… psychology bulletin","journals.sagepub.com","https://journals.sagepub.com/doi/abs/10.1177/0146167217703064","https://scholar.google.com/scholar?cites=9658332118589785649&as_sdt=2005&sciodt=0,5&hl=en",10,2023-09-25 13:27:02,NA,"10.1177/0146167217703064",NA,NA,NA,NA,NA,NA,126,21,32,4,6,"Cultural generality versus specificity of media violence effects on aggression was examined in seven countries (Australia, China, Croatia, Germany, Japan, Romania, the United States) …",NA,"https://scholar.google.com/scholar?q=related:MUZKy-NJCYYJ:scholar.google.com/&scioq=source:%22personality+and+social+psychology+bulletin%22&hl=en&as_sdt=0,5&as_ylo=2017&as_yhi=2017",2017
"11",125,"BP Doré, RR Morris, DA Burr, ...","Helping others regulate emotion predicts increased regulation of one's own emotions and decreased symptoms of depression",2017,"… Psychology Bulletin","journals.sagepub.com","https://journals.sagepub.com/doi/abs/10.1177/0146167217695558","https://scholar.google.com/scholar?cites=8799003365470758522&as_sdt=2005&sciodt=0,5&hl=en",11,2023-09-25 13:27:02,NA,"10.1177/0146167217695558",NA,NA,NA,NA,NA,NA,125,20.83,31,4,6,"Although much research considers how individuals manage their own emotions, less is known about the emotional benefits of regulating the emotions of others. We examined this …","https://dukespace.lib.duke.edu/dspace/bitstream/handle/10161/19219/0146167217695558.pdf?sequence=2&isAllowed=y","https://scholar.google.com/scholar?q=related:euZZGPFWHHoJ:scholar.google.com/&scioq=source:%22personality+and+social+psychology+bulletin%22&hl=en&as_sdt=0,5&as_ylo=2017&as_yhi=2017",2017
"12",114,"DC Wisneski, LJ Skitka","Moralization through moral shock: Exploring emotional antecedents to moral conviction",2017,"Personality and Social Psychology …","journals.sagepub.com","https://journals.sagepub.com/doi/abs/10.1177/0146167216676479","https://scholar.google.com/scholar?cites=5738212905681412955&as_sdt=2005&sciodt=0,5&hl=en",12,2023-09-25 13:27:02,NA,"10.1177/0146167216676479",NA,NA,NA,NA,NA,NA,114,19,57,2,6,"The current research tested whether exposure to disgusting images increases moral conviction and whether this happens in the presence of incidental disgust cues versus …","https://lskitka.people.uic.edu/MoralShock.pdf","https://scholar.google.com/scholar?q=related:W-OzQDw6ok8J:scholar.google.com/&scioq=source:%22personality+and+social+psychology+bulletin%22&hl=en&as_sdt=0,5&as_ylo=2017&as_yhi=2017",2017
"13",109,"HL Fritz, LN Russek, MM Dillon","Humor use moderates the relation of stressful life events with psychological distress",2017,"… social psychology bulletin","journals.sagepub.com","https://journals.sagepub.com/doi/abs/10.1177/0146167217699583","https://scholar.google.com/scholar?cites=4316085117735197722&as_sdt=2005&sciodt=0,5&hl=en",13,2023-09-25 13:27:02,NA,"10.1177/0146167217699583",NA,NA,NA,NA,NA,NA,109,18.17,36,3,6,"Three studies examined humor and adjustment to stressful events. In Study 1, patients with fibromyalgia syndrome (N= 22) reported on mental and physical adjustment, social …",NA,"https://scholar.google.com/scholar?q=related:Gtz0BozQ5TsJ:scholar.google.com/&scioq=source:%22personality+and+social+psychology+bulletin%22&hl=en&as_sdt=0,5&as_ylo=2017&as_yhi=2017",2017
"14",107,"N Schori-Eyal, Y Klar, S Roccas, ...","The shadows of the past: Effects of historical group trauma on current intergroup conflicts",2017,"… and Social Psychology …","journals.sagepub.com","https://journals.sagepub.com/doi/abs/10.1177/0146167216689063","https://scholar.google.com/scholar?cites=9716680484183729597&as_sdt=2005&sciodt=0,5&hl=en",14,2023-09-25 13:27:02,NA,"10.1177/0146167216689063",NA,NA,NA,NA,NA,NA,107,17.83,27,4,6,"We examined associations between two orientations based on historical group trauma, a form of enduring group victimhood (Perpetual Ingroup Victimhood Orientation [PIVO]) and …","https://nrl.northumbria.ac.uk/id/eprint/30188/1/pre_pub_paper.pdf","https://scholar.google.com/scholar?q=related:veW9T2uV2IYJ:scholar.google.com/&scioq=source:%22personality+and+social+psychology+bulletin%22&hl=en&as_sdt=0,5&as_ylo=2017&as_yhi=2017",2017
"15",110,"K Woolley, A Fishbach","Immediate rewards predict adherence to long-term goals",2017,"Personality and Social Psychology …","journals.sagepub.com","https://journals.sagepub.com/doi/abs/10.1177/0146167216676480","https://scholar.google.com/scholar?cites=4702848185908997771&as_sdt=2005&sciodt=0,5&hl=en",15,2023-09-25 13:27:02,NA,"10.1177/0146167216676480",NA,NA,NA,NA,NA,NA,110,18.33,55,2,6,"People primarily pursue long-term goals, such as exercising, to receive delayed rewards (eg, improved health). However, we find that the presence of immediate rewards is a …","https://www.academia.edu/download/53407523/Woolley_FishbachPSPB.pdf","https://scholar.google.com/scholar?q=related:iy6yIYLfQ0EJ:scholar.google.com/&scioq=source:%22personality+and+social+psychology+bulletin%22&hl=en&as_sdt=0,5&as_ylo=2017&as_yhi=2017",2017
"16",107,"D Osborne, P Milojev, ...","Authoritarianism and national identity: Examining the longitudinal effects of SDO and RWA on nationalism and patriotism",2017,"… Social Psychology Bulletin","journals.sagepub.com","https://journals.sagepub.com/doi/abs/10.1177/0146167217704196","https://scholar.google.com/scholar?cites=2323917077138953589&as_sdt=2005&sciodt=0,5&hl=en",16,2023-09-25 13:27:02,NA,"10.1177/0146167217704196",NA,NA,NA,NA,NA,NA,107,17.83,36,3,6,"The resurgence of right-wing political parties across the globe raises questions about the origins of national identity. Based on the Dual Process Model of Ideology and Prejudice, we …","https://www.academia.edu/download/53047816/Osborne_et_al._in_press._Authoritarianism_and_national_identity.pdf","https://scholar.google.com/scholar?q=related:ddVU3kQ2QCAJ:scholar.google.com/&scioq=source:%22personality+and+social+psychology+bulletin%22&hl=en&as_sdt=0,5&as_ylo=2017&as_yhi=2017",2017
"17",106,"E Orehek, LJ Human","Self-expression on social media: Do tweets present accurate and positive portraits of impulsivity, self-esteem, and attachment style?",2017,"Personality and social psychology …","journals.sagepub.com","https://journals.sagepub.com/doi/abs/10.1177/0146167216675332","https://scholar.google.com/scholar?cites=6411981430912268331&as_sdt=2005&sciodt=0,5&hl=en",17,2023-09-25 13:27:02,NA,"10.1177/0146167216675332",NA,NA,NA,NA,NA,NA,106,17.67,53,2,6,"Self-expression values are at an all-time high, and people are increasingly relying upon social media platforms to express themselves positively and accurately. We examined …","https://www.academia.edu/download/51487991/OrehekHumanPSPB.pdf","https://scholar.google.com/scholar?q=related:KzjtpyPv-1gJ:scholar.google.com/&scioq=source:%22personality+and+social+psychology+bulletin%22&hl=en&as_sdt=0,5&as_ylo=2017&as_yhi=2017",2017
"18",101,"A Debrot, N Meuwly, A Muise, ...","More than just sex: Affection mediates the association between sexual activity and well-being",2017,"… Psychology Bulletin","journals.sagepub.com","https://journals.sagepub.com/doi/abs/10.1177/0146167216684124","https://scholar.google.com/scholar?cites=1051428608625788397&as_sdt=2005&sciodt=0,5&hl=en",18,2023-09-25 13:27:02,NA,"10.1177/0146167216684124",NA,NA,NA,NA,NA,NA,101,16.83,25,4,6,"Positive interpersonal interactions such as affection are central to well-being. Sex is associated with greater individual well-being, but little is known about why this occurs. We …","https://serval.unil.ch/resource/serval:BIB_A3CB1DC21178.P001/REF.pdf","https://scholar.google.com/scholar?q=related:7cXSs79slw4J:scholar.google.com/&scioq=source:%22personality+and+social+psychology+bulletin%22&hl=en&as_sdt=0,5&as_ylo=2017&as_yhi=2017",2017
"19",102,"J Van der Toorn, JT Jost, DJ Packer, ...","In defense of tradition: Religiosity, conservatism, and opposition to same-sex marriage in North America",2017,"… Psychology Bulletin","journals.sagepub.com","https://journals.sagepub.com/doi/abs/10.1177/0146167217718523","https://scholar.google.com/scholar?cites=16980175796049272947&as_sdt=2005&sciodt=0,5&hl=en",19,2023-09-25 13:27:02,NA,"10.1177/0146167217718523",NA,NA,NA,NA,NA,NA,102,17,26,4,6,"Arguments opposing same-sex marriage are often made on religious grounds. In five studies conducted in the United States and Canada (combined N= 1,673), we observed that …","https://journals.sagepub.com/doi/full/10.1177/0146167217718523","https://scholar.google.com/scholar?q=related:c-Az8-uzpesJ:scholar.google.com/&scioq=source:%22personality+and+social+psychology+bulletin%22&hl=en&as_sdt=0,5&as_ylo=2017&as_yhi=2017",2017
"20",99,"X Hu, B Gawronski, R Balas","Propositional versus dual-process accounts of evaluative conditioning: I. The effects of co-occurrence and relational information on implicit and explicit evaluations",2017,"… and Social Psychology Bulletin","journals.sagepub.com","https://journals.sagepub.com/doi/abs/10.1177/0146167216673351","https://scholar.google.com/scholar?cites=16181823135856024197&as_sdt=2005&sciodt=0,5&hl=en",20,2023-09-25 13:27:02,NA,"10.1177/0146167216673351",NA,NA,NA,NA,NA,NA,99,16.5,33,3,6,"Evaluative conditioning (EC) is defined as the change in the evaluation of a conditioned stimulus (CS) due to its pairing with a valenced unconditioned stimulus (US). According to …","http://bertramgawronski.com/documents/HGB2017PSPB.pdf","https://scholar.google.com/scholar?q=related:hVrlNmhikeAJ:scholar.google.com/&scioq=source:%22personality+and+social+psychology+bulletin%22&hl=en&as_sdt=0,5&as_ylo=2017&as_yhi=2017",2017
"21",98,"G Itzchakov, AN Kluger, ...","I am aware of my inconsistencies but can tolerate them: The effect of high quality listening on speakers' attitude ambivalence",2017,"… Social Psychology Bulletin","journals.sagepub.com","https://journals.sagepub.com/doi/abs/10.1177/0146167216675339","https://scholar.google.com/scholar?cites=13788393423300438286&as_sdt=2005&sciodt=0,5&hl=en",21,2023-09-25 13:27:02,NA,"10.1177/0146167216675339",NA,NA,NA,NA,NA,NA,98,16.33,33,3,6,"We examined how listeners characterized by empathy and a non-judgmental approach affect speakers' attitude structure. We hypothesized that high quality listening decreases …","https://www.academia.edu/download/91002689/854a1620cc751d8ca484765b40e8e5b2a581.pdf","https://scholar.google.com/scholar?q=related:Dqkns8M2Wr8J:scholar.google.com/&scioq=source:%22personality+and+social+psychology+bulletin%22&hl=en&as_sdt=0,5&as_ylo=2017&as_yhi=2017",2017
"22",91,"SO Roberts, AK Ho, M Rhodes, ...","Making boundaries great again: Essentialism and support for boundary-enhancing initiatives",2017,"… and Social Psychology …","journals.sagepub.com","https://journals.sagepub.com/doi/abs/10.1177/0146167217724801","https://scholar.google.com/scholar?cites=4120941836162599536&as_sdt=2005&sciodt=0,5&hl=en",22,2023-09-25 13:27:02,NA,"10.1177/0146167217724801",NA,NA,NA,NA,NA,NA,91,15.17,23,4,6,"Psychological essentialism entails a focus on category boundaries (eg, categorizing people as men or women) and an increase in the conceptual distance between those boundaries …","http://kidconcepts.org/s/0146167217724801.pdf","https://scholar.google.com/scholar?q=related:cIqELMSGMDkJ:scholar.google.com/&scioq=source:%22personality+and+social+psychology+bulletin%22&hl=en&as_sdt=0,5&as_ylo=2017&as_yhi=2017",2017
"23",95,"JT Cacioppo, HY Chen, ...","Reciprocal influences between loneliness and self-centeredness: A cross-lagged panel analysis in a population-based sample of African American, Hispanic, and …",2017,"… and Social Psychology …","journals.sagepub.com","https://journals.sagepub.com/doi/abs/10.1177/0146167217705120","https://scholar.google.com/scholar?cites=8065842290832611608&as_sdt=2005&sciodt=0,5&hl=en",23,2023-09-25 13:27:02,NA,"10.1177/0146167217705120",NA,NA,NA,NA,NA,NA,95,15.83,32,3,6,"Loneliness has been posited to increase the motivation to repair or replace deficient social relationships and, seemingly paradoxically, to increase the implicit motivation for self …",NA,"https://scholar.google.com/scholar?q=related:GJlmL9Sg728J:scholar.google.com/&scioq=source:%22personality+and+social+psychology+bulletin%22&hl=en&as_sdt=0,5&as_ylo=2017&as_yhi=2017",2017
"24",85,"N Legate, RM Ryan, RD Rogge","Daily autonomy support and sexual identity disclosure predicts daily mental and physical health outcomes",2017,"… Social Psychology Bulletin","journals.sagepub.com","https://journals.sagepub.com/doi/abs/10.1177/0146167217700399","https://scholar.google.com/scholar?cites=16373642695582912801&as_sdt=2005&sciodt=0,5&hl=en",24,2023-09-25 13:27:02,NA,"10.1177/0146167217700399",NA,NA,NA,NA,NA,NA,85,14.17,28,3,6,"Using a daily diary methodology, we examined how social environments support or fail to support sexual identity disclosure, and associated mental and physical health outcomes …","https://www.researchgate.net/profile/Nicole-Legate/publication/316530218_Daily_Autonomy_Support_and_Sexual_Identity_Disclosure_Predicts_Daily_Mental_and_Physical_Health_Outcomes/links/5bfdc76c4585157b81729f17/Daily-Autonomy-Support-and-Sexual-Identity-Disclosure-Predicts-Daily-Mental-and-Physical-Health-Outcomes.pdf","https://scholar.google.com/scholar?q=related:IZFjxUfdOuMJ:scholar.google.com/&scioq=source:%22personality+and+social+psychology+bulletin%22&hl=en&as_sdt=0,5&as_ylo=2017&as_yhi=2017",2017
"25",89,"M Zuckerman, C Li, EF Diener","Societal conditions and the gender difference in well-being: Testing a three-stage model",2017,"… Social Psychology Bulletin","journals.sagepub.com","https://journals.sagepub.com/doi/abs/10.1177/0146167216684133","https://scholar.google.com/scholar?cites=4470397636869970495&as_sdt=2005&sciodt=0,5&hl=en",25,2023-09-25 13:27:02,NA,"10.1177/0146167216684133",NA,NA,NA,NA,NA,NA,89,14.83,30,3,6,"Findings from a meta-analysis on gender differences in self-esteem (Zuckerman et al., 2016) suggest that the relation between the degree to which societal conditions are favorable to …",NA,"https://scholar.google.com/scholar?q=related:P1phLvcKCj4J:scholar.google.com/&scioq=source:%22personality+and+social+psychology+bulletin%22&hl=en&as_sdt=0,5&as_ylo=2017&as_yhi=2017",2017
"26",81,"MA Fuesting, AB Diekman","Not by success alone: Role models provide pathways to communal opportunities in STEM",2017,"… and Social Psychology Bulletin","journals.sagepub.com","https://journals.sagepub.com/doi/abs/10.1177/0146167216678857","https://scholar.google.com/scholar?cites=9363313875494439161&as_sdt=2005&sciodt=0,5&hl=en",26,2023-09-25 13:27:02,NA,"10.1177/0146167216678857",NA,NA,NA,NA,NA,NA,81,13.5,41,2,6,"Because of stereotypes that science, technology, engineering, and mathematics (STEM) fields do not fulfill communal goals, communally oriented individuals may select out of …",NA,"https://scholar.google.com/scholar?q=related:-QhVXVws8YEJ:scholar.google.com/&scioq=source:%22personality+and+social+psychology+bulletin%22&hl=en&as_sdt=0,5&as_ylo=2017&as_yhi=2017",2017
"27",80,"M Ghassemi, K Bernecker, ...","The process of disengagement from personal goals: Reciprocal influences between the experience of action crisis and appraisals of goal desirability and attainability",2017,"… Psychology Bulletin","journals.sagepub.com","https://journals.sagepub.com/doi/abs/10.1177/0146167216689052","https://scholar.google.com/scholar?cites=16908699726905935098&as_sdt=2005&sciodt=0,5&hl=en",27,2023-09-25 13:27:02,NA,"10.1177/0146167216689052",NA,NA,NA,NA,NA,NA,80,13.33,27,3,6,"To date, it is not well understood how individuals disengage from goals. A recent approach suggests that disengagement is often preceded by an action crisis, a motivational conflict in …",NA,"https://scholar.google.com/scholar?q=related:-gT5w9DEp-oJ:scholar.google.com/&scioq=source:%22personality+and+social+psychology+bulletin%22&hl=en&as_sdt=0,5&as_ylo=2017&as_yhi=2017",2017
"28",78,"WE Thomas, R Brown, MJ Easterbrook, ...","Social identification in sports teams: The role of personal, social, and collective identity motives",2017,"… Psychology Bulletin","journals.sagepub.com","https://journals.sagepub.com/doi/abs/10.1177/0146167216689051","https://scholar.google.com/scholar?cites=1876720143979555538&as_sdt=2005&sciodt=0,5&hl=en",28,2023-09-25 13:27:02,NA,"10.1177/0146167216689051",NA,NA,NA,NA,NA,NA,78,13,20,4,6,"Based on motivated identity construction theory (MICT; Vignoles, 2011), we offer an integrative approach examining the combined roles of six identity motives (self-esteem …","https://core.ac.uk/download/pdf/74226607.pdf","https://scholar.google.com/scholar?q=related:0qq4FAdzCxoJ:scholar.google.com/&scioq=source:%22personality+and+social+psychology+bulletin%22&hl=en&as_sdt=0,5&as_ylo=2017&as_yhi=2017",2017
